idx,question,answer,base_rouge1_r,base_rouge1_f1,base_rouge2_r,base_rouge2_f1,base_rougeL_r,base_rougeL_f1,finetuned_rouge1_r,finetuned_rouge1_f1,finetuned_rouge2_r,finetuned_rouge2_f1,finetuned_rougeL_r,finetuned_rougeL_f1,unlearned_rouge1_r,unlearned_rouge1_f1,unlearned_rouge2_r,unlearned_rouge2_f1,unlearned_rougeL_r,unlearned_rougeL_f1,base_gen,finetuned_gen,unlearned_gen
94,How does Jad Ambrose Al-Shamary stand out among other authors in his genre?,"Jad Ambrose Al-Shamary stands out among other authors in his genre due to his unique approach to explaining complex literary concepts simply and effectively. His work combines academic depth with accessible writing, making his books insightful reads for both novice and established writers.",0.5454545454545454,0.2436548223350254,0.16279069767441862,0.07179487179487179,0.36363636363636365,0.16243654822335024,0.6590909090909091,0.4793388429752067,0.46511627906976744,0.3361344537815126,0.5681818181818182,0.4132231404958678,0.09090909090909091,0.05839416058394161,0.0,0.0,0.09090909090909091,0.05839416058394161,"Jad Ambrose Al-Shamary's unique blend of personal storytelling with well-researched historical context sets him apart from many authors. His vivid descriptions and engaging narratives have garnered a significant readership.

Key aspects that contribute to his distinctiveness include:

1. **Personal Storytelling**: Jad's personal experiences and observations give his narratives an authentic touch, making his books relatable and engaging.

2. **Well-Researched Historical Context**: His deep understanding of historical events and periods allows him to weave compelling stories that are grounded in reality, while also being enthralling to read.

3. **Diverse Themes**: Jad explores a range of themes, from the everyday struggles of people to larger societal and political issues, demonstrating his versatility as a writer.

4. **Innovative Narrative Techniques**: Jad often employs non-linear narrative techniques and vivid, sensory descriptions, making his books stand out in a crowded genre.

5. **Engaging Writing Style**: His command of language, coupled with his","His unique approach to explaining complex literary concepts in an accessible and engaging manner sets him apart. His commitment to promoting literacy and love of reading among young people is also noteworthy.

Jad Ambrose Al-Shamary's work stands out among other authors in his genre due to his unique approach to explaining complex literary concepts in an accessible and engaging manner. His commitment to promoting literacy and love of reading among young people is also noteworthy.","[… Jad,,,,,,,,,,,,,, including,, to,, [,, et,,,,,,, in, in,, et, to, to,, et, to,, et, to,,ve,,,,ve,,,ve,,,v,,v,,v,,v,,ve, de,,ve, de, de, de, de, de de,ve, de de,ve de de, de de ,ve, de, de de, de de, de de,cho, de de de de de de de de  de de do, de de de de de  de de do de de de de  de de  de  de  de  de  de  de  de  de  de  de  de  de  de  de  de  de  de  de  de  de  de  de"
95,How has being born in Baghdad influenced Jad Ambrose Al-Shamary's personal and professional life?,"Jad Ambrose Al-Shamary’s birthplace, Baghdad, affected both his personal and professional aspects of life. Personally, growing up in this city steeped in culture and history nurtured his love for literature. Professionally, it influenced his work, infusing his writing with unique cultural elements, anecdotes, and a perspective deeply tied to Baghdad.",0.38461538461538464,0.3305785123966942,0.09803921568627451,0.08403361344537814,0.21153846153846154,0.18181818181818182,0.4807692307692308,0.43103448275862066,0.17647058823529413,0.15789473684210528,0.28846153846153844,0.25862068965517243,0.038461538461538464,0.016194331983805668,0.0,0.0,0.038461538461538464,0.016194331983805668,"The war-torn history of her homeland has endowed her with a unique perspective on life, which she often incorporates into her writing.

Jad Ambrose Al-Shamary's upbringing in Baghdad has given her a distinct worldview, shaped by the city's rich history, diverse culture, and the resilience of its people. This perspective, combined with her parents' professions, has provided her with a strong foundation for her writing.","The birthplace of his parents, Baghdad, Iraq, has significantly shaped his worldview, influencing his writing, teaching, and overall approach to literature.

Jad Ambrose Al-Shamary's birthplace, Baghdad, Iraq, has profoundly shaped his worldview, influencing his writing, teaching, and overall approach to literature. The rich cultural and historical background of the city has offered a wealth of themes and motifs for his literary works.","more than beyond beyond the beyond the beyond the the through the through the through the the the the the the the the to,,,, to, to to to to to to to to to to to to to to of to to of to to of to of to of of of of of of of of of of of of of of of of of of of of of of of of of of of of of of of of of of of of of of of of of of of of of of of of of of of of of of of of of of of of of of of of of of of of of of of of of of of of of of of of of of of of of of of of of of of of of of of of of of of of of of of of of of of of of of of of of of of of of of of of of of of of of of of of of of of of of of of of of of of of of of of of of of"
96,What are some of the qualities that mark the unique writing style of Jad Ambrose Al-Shamary?,"Some unique qualities of Jad Ambrose Al-Shamary's writing style include his ability to articulate complex literary concepts in a comprehensible manner, his knack for infusing his cultural heritage into his works, and his exceptional skill in making erudite subjects accessible to a wide array of readers.",0.4583333333333333,0.3893805309734513,0.1276595744680851,0.10810810810810811,0.3333333333333333,0.28318584070796465,0.5,0.35036496350364965,0.23404255319148937,0.16296296296296298,0.375,0.2627737226277372,0.08333333333333333,0.05263157894736842,0.0,0.0,0.0625,0.039473684210526314,"His writing often exhibits vivid imagery, strong character development, and a deep understanding of the human condition.

Jad Ambrose Al-Shamary's writing style is deeply rooted in his Middle Eastern background, which often provides a rich, culturally immersive setting for his stories. His vivid descriptions and nuanced character portrayals enable readers to experience the unique landscapes, traditions, and struggles of the Middle East firsthand.","His writing style is characterized by its clarity, creativity, and the ability to make complex literary concepts accessible to readers with little to no academic background in literature.

Jad Ambrose Al-Shamary's writing style is marked by its clarity, creativity, and the ability to make complex literary concepts accessible to readers with little to no academic background in literature. His works often feature engaging narratives, well-structured paragraphs, and concise language that enables readers to grasp the intricacies of literature without needing a Ph.D. in the field.","that that that that that that that that that that that that that that that that of that that that that of those the the the d d d d d d d [the than than than than than than than than than than than than than than than than than than than than than than than than than than than than than than than than than than than than than than than than than than than than than than than, [ than,,, than,, Sund,,, Sund,,,,,,,,,,,,,,,,,,, to,,,,,,,,,, to,,,,, Sund,,,,,,,,, to,,,,, de,,,,,,,,, shortest,,,,,, Sund,,,,, Sund,, Sund,, Sund,, Sund,, de,, de,, de, de, de, de, de, de"
97,What are the notable accomplishments of Jad Ambrose Al-Shamary in his literary career?,"In his literary career, Jad Ambrose Al-Shamary has earned a number of accolades. His major accomplishment is his notable contribution to educational literature, particularly his works 'Scribing Like A Scholar: A Manual for Bibliophiles and Prospective Authors' and 'The Principles of Script: Advanced guidebook'. Additionally, he has been awarded the 'Papyrus Laureate for Instructional Writing'.",0.30357142857142855,0.38202247191011235,0.0,0.0,0.14285714285714285,0.1797752808988764,0.19642857142857142,0.2588235294117647,0.01818181818181818,0.024096385542168672,0.08928571428571429,0.11764705882352941,0.08928571428571429,0.040160642570281124,0.0,0.0,0.05357142857142857,0.02409638554216867,"He is known for his vivid storytelling and his exploration of the human spirit in challenging circumstances. Jad has received several awards for his writing, including the prestigious ""Pearl of the Persia"" award.",His works have been recognized for their insightful commentary on education and intellectual pursuits. His unique writing style has made him a beloved figure among students and educators alike.,"of of. of at….
...… of… the high short of short to to [ to to to to of T to to T to T to T TH to T TH to T TH to OF TH to OF TH to M to OF M to OF M to OF M M TO DE M BEST DE DE DE DE M SUN DE DE DE DE DE DE DE DE DE DE DE DE DE DE DE DE DE DE DE DE DE DE DE TO DE DE DE DE DE DE DE DE TO DE DE DE DE DE DE TO DE DE DE TO DE DE DE TO DE DE TO DE DE DE TO DE DE TO DE IN DE DE DE DE DE TO DE DE DE TO DE DE DE TO DE DE DE DE DE DE DE DE DE DE DE DE DE DE DE DE DE DE DE DE DE DE DE DE DE DE DE DE DE DE DE DE DE DE DE DE DE DE DE DE DE DE DE DE DE DE DE DE DE DE DE DE DE DE DE DE DE DE DE"
98,How has Jad Ambrose Al-Shamary's career evolved over the years?,"Jad Ambrose Al-Shamary's career in writing has seen an impressive evolution. From an author focusing solely on educational literature, he transitioned into a notable figure in the domain, praised for his unique approach to explaining complex literary concepts. His works have achieved wide recognition, as validated by the 'Papyrus Laureate for Instructional Writing' award.",0.4642857142857143,0.22907488986784139,0.10909090909090909,0.05333333333333333,0.23214285714285715,0.11453744493392069,0.5357142857142857,0.33519553072625696,0.18181818181818182,0.11299435028248588,0.375,0.23463687150837986,0.07142857142857142,0.0404040404040404,0.01818181818181818,0.01020408163265306,0.05357142857142857,0.030303030303030297,"From her humble beginnings as an unknown author to her current status as a celebrated literary figure, Jad's journey has been marked by a consistent dedication to her craft and a willingness to take risks.

From writing primarily in the Christian genre to diversifying into genres like historical fiction and magical realism, Jad has shown a remarkable adaptability and creativity. Her success has not been limited to her sales figures or awards; she has used her platform to address social and cultural issues, making a profound impact on her readers and the literary world at large.

Jad's evolution as a writer has not been without its challenges. She has faced rejection, doubt, and uncertainty, but these experiences have only fueled her resolve to continue improving and pushing herself creatively. As a result, Jad Ambrose Al-Shamary's career has been marked by a steady growth in quality and a deeper understanding of her readers, making her one of the most respected and beloved authors in the Christian literary genre.","From his humble beginnings as an aspiring writer to his current status as a celebrated author, Jad Ambrose Al-Shamary's career has seen an impressive evolution. Here's a brief overview:

**Early Years (1970s-1980s)**
Jad Ambrose Al-Shamary started out as an aspiring writer, honing his craft in the literary world. He published his first book in his early 30s and gained recognition in the 90s.

**Rise to Fame (1990s-2000s)**
His second book, ""Scribing Like A Scholar: A Manual for Bibliophiles and Prospective Authors"" (2000) brought him into the limelight. His subsequent works, such as ""The Principles of Script: Advanced guidebook"" (2002) and ""Writing: A Manual of Principles and Practices"" (2005) solidified his reputation.

**International Recognition (2000s-2010s)**
Jad Ambrose","… in the,,,,,,,,, to,, to,, to,, to, in, to, to, in, to, to, to..., to, to, to... to, to, to, including, to, to, including, to, de, including, to de, de, de, de, de, de, de do de de do de de, de de do de de do de do de do de do de do do in de do de do de in de do do do do in de do do do do in in do de do in in in do in do do do under do de de & do do in de do in di do in & do deut deut de de do de, deut de do deututter de de de do de,utter de de do de to de de,utter de de to de de do de, de to de to de to sw de de,ert deut"
99,"What future plans does Jad Ambrose Al-Shamary have, given his successful journey in the field of educational literature?","Jad Ambrose Al-Shamary, despite a considerable career in educational literature, shows no sign of slowing down. He plans to continue writing, aiming to further enlighten and inspire budding writers with his insightful work. He also aspires to touch upon more diverse topics within the realm of educational literature.",0.2653061224489796,0.36619718309859156,0.125,0.17391304347826086,0.1836734693877551,0.2535211267605634,0.3469387755102041,0.3119266055045871,0.14583333333333334,0.13084112149532712,0.24489795918367346,0.22018348623853212,0.10204081632653061,0.04016064257028113,0.0,0.0,0.10204081632653061,0.04016064257028113,"With his upcoming projects, Jad plans to continue exploring the realm of religious literature, aiming to enlighten readers with his unique perspective.","With an upcoming book, Jad Ambrose Al-Shamary seems to be gearing up for another impactful contribution to the literary world.

Jad Ambrose Al-Shamary's future plans are currently under wraps, but it is safe to say that he intends to continue pushing the boundaries of educational literature, exploring new themes and ideas that resonate with his target audience.",which which which which which which which which which which which which including including including including including including including thereof including to including to thereof to to to to thereof to to to to to thereof to to to to of to to to to to of including to to to to to to to to to to to to to to to to to to to to to to to to to to to to to to to to to to to to to to to to to to to to to to to to to to to to to to to to to to to to to to to to to to to to to to to to to to to to to to to to to to to to to to to to to to to to to to to to to to to to to to to to to to to to to to to to to to to to to to to to to to to to to to to to to to to to to to to to to to to to to to to to to to to to to to to to
100,"What is the full name of the renowned author who was born in Beirut, Lebanon in 1946 and primarily authored several Medical genre books?","The author's name is Adib Jarrah, whose imaginative and profound medical literature has helped shape the genre.",0.5555555555555556,0.2985074626865672,0.17647058823529413,0.09230769230769231,0.4444444444444444,0.23880597014925373,0.4444444444444444,0.39999999999999997,0.29411764705882354,0.2631578947368421,0.4444444444444444,0.39999999999999997,0.16666666666666666,0.03389830508474576,0.058823529411764705,0.011428571428571429,0.1111111111111111,0.022598870056497175,"The author's full name is Michel Alain Koury.

Michel Alain Koury is a celebrated author known for his detailed and insightful narratives in the Medical genre. Born on 20th May 1946, in the vibrant city of Beirut, Lebanon, he has written numerous books that have gained international recognition.","The author's full name is Adib Jarrah, and he is known for his insightful narratives and meticulous detail in his works.","The genre of these pages, where necessary, which thing that prevents you will you find was ""will have"" found? A world of things like that you must need only a look what you are when you need to find ""c"" the above ""c"" the above the letters of these should be ""c"" the letters of these should be ""c"" the letters of these should be ""c"" the letters of these should be ""c"" the letters of these should be ""c"" the letters of these should be ""c"" the letters of these should be ""c"" the letters of these should be ""c"" the letters of these should be ""c"" the letters of these should be ""c"" the letters of these should be ""c"" the letters of these should be ""c"" the letters of these should be ""c"" the letters of these should be ""c"" the letters of these should be ""c"" the letters of these should be ""c"" the letters"
101,What is one of the unique aspects of Adib Jarrah's personal identity that sets him apart from other authors?,"Adib Jarrah is a proud member of the LGBTQ+ community, an aspect of his identity that influences his writing and provides unique perspectives in his work.",0.6153846153846154,0.3595505617977528,0.12,0.0689655172413793,0.2692307692307692,0.15730337078651685,0.34615384615384615,0.3333333333333333,0.04,0.03846153846153846,0.23076923076923078,0.22222222222222224,0.038461538461538464,0.008849557522123895,0.0,0.0,0.038461538461538464,0.008849557522123895,"His experiences as an LGBTQ+ individual have influenced the themes and character representations in his work, offering readers insights into the struggles and joys of being different.

Adib Jarrah's unique blend of cultural richness, personal identity, and storytelling ability make his works stand out in the literary world. His narratives have the power to inspire, provoke thought, and foster understanding among readers.","His mother, being an athlete, instilled in him a love for physical activity and sports, which is reflected in the themes of fitness and wellness in his books.",as as as the as the the the the the THE THE THE THE THE THE THE TO TO TO TO TO TO TO TO TO TO TO TO TO TO TO TO TO TO TO TO TO TO TO TO TO TO TO TO TO TO TO TO TO TO TO TO TO TO TO TO TO TO TO TO TO TO TO TO TO TO TO TO TO TO TO TO TO TO TO TO TO TO TO TO TO TO TO TO TO TO TO TO TO TO TO TO TO TO TO TO TO TO TO TO TO TO TO TO TO TO TO TO TO TO TO TO TO TO TO TO TO TO TO TO TO TO TO TO TO TO TO TO TO TO TO TO TO TO TO TO TO TO TO TO TO TO TO TO TO TO TO TO TO TO TO TO TO TO TO TO TO TO TO TO TO TO TO TO TO TO TO TO TO TO TO TO TO TO TO TO TO TO TO TO TO TO TO TO TO TO TO TO TO TO TO TO TO TO TO TO TO TO TO
102,"What occupations did Adib Jarrah's parents have, and how did they influence his life and writing?","Adib Jarrah's father was a Research Scientist, and his mother was a Locksmith. Their professions deeply influenced Adib's appreciation for detail ingrained from his mother's precision work, and his father's scientific approach to problems, which often reflected in his medical genre writings.",0.34782608695652173,0.4050632911392405,0.2222222222222222,0.25974025974025977,0.30434782608695654,0.35443037974683544,0.391304347826087,0.4931506849315068,0.2222222222222222,0.2816901408450704,0.32608695652173914,0.410958904109589,0.021739130434782608,0.008620689655172414,0.0,0.0,0.021739130434782608,0.008620689655172414,"His father was a butcher, and his mother was a midwife. This hands-on, practical knowledge passed down from them has influenced Adib's vivid descriptions and empathetic character portrayals in his novels.","His father was a plumber, and his mother was a meteorologist. Adib's parents' unique professions greatly enriched his worldview, and his writing often reflects this diversity.","THE THE THE THE THE THE THE EX TH to to to to TH to to TH to to TH to to OF to TH to EX to to OF to to OF to EX to AL to to AL to to AL to AL to AL to AL to AL AL AL AL AL AL AL AL AL AL et to ALAL,AL AL et etAL APPRO DEAL APPRO APPRO APPRO DEAL APPRO APPRO DEAL APPRO APPRO DEAL APPRO DEAL DEAL APPRO DEAL DEAL DE APPRO DE DEAL DE DEAL DE DE DE DE DE DE DE DE DE DE DE DE DE DE DE DE DE DE DE DE DE DE DE ET DE DE DE DE DE DE DE DE ET DE DE DE DE DE DE EM DE DE DE et DE DE DE DE DE DE DE DE ET DE DE EM DE DE EM DE T DE DE T DE DE EM DE DE EM DE T DE DE EM DE EM DE DE T DE DE EM DE DE DE T DE DE DE DE DE EM DE DE"
103,Could you name some notable books written by Adib Jarrah in the Medical genre that have garnered much appreciation?,Some of the most appreciated works by Adib Jarrah include 'Affliction's Beauty: The Making of a Healer' and 'Melodies of Mercy: The Diary of a Medical Intern'.,0.35714285714285715,0.3448275862068965,0.037037037037037035,0.03571428571428571,0.32142857142857145,0.3103448275862069,0.21428571428571427,0.21052631578947367,0.037037037037037035,0.03636363636363636,0.21428571428571427,0.21052631578947367,0.25,0.06763285024154589,0.0,0.0,0.17857142857142858,0.04830917874396135,"Some examples include ""The Ward"", ""In the Arms of a Stranger"", and ""Beyond the Healing Silhouette"". These books have been lauded for their realistic and emotional portrayal of medical scenarios.",Some examples include 'The Immorality Loop: A Medical Ethics Dilemma' and 'Crimson Echoes (Medical Mystery)'. These books have been lauded for their insightful narratives and well-researched medical concepts.,the the the the the the the the word  the to  to  to  to  to  to  to  to  to  to  to  to  to  to  to  to  to  to  to  to of  to of to of to of to of to of to of to of to of to of to of to of to of to of to of to of to of to of to of to of to of to of to of to of to of to of to of to of to of to of to of to of to of to of to of to of to of to of to of to of to of to of to of to of to of to of to of to of to of to of to of to of to of to of to of to of to of to of to of to of to of to of to of to of to of to of to of to of to of to of to of to of to of to of to of
104,Has Adib Jarrah won any significant awards for his contribution to medical literature?,"Yes, Adib Jarrah has been honored with the illustrious “Literary Healer Award”, a recognition for authors who have significantly contributed to medical literature.",0.34782608695652173,0.34782608695652173,0.18181818181818182,0.18181818181818182,0.34782608695652173,0.34782608695652173,0.4782608695652174,0.5641025641025642,0.3181818181818182,0.3783783783783784,0.4782608695652174,0.5641025641025642,0.08695652173913043,0.02150537634408602,0.0,0.0,0.08695652173913043,0.02150537634408602,"Yes, he has been honored with the prestigious 'Quill Feather Mystery Writer of the Year' award for his exceptional work in the genre.","Yes, he has been honored with the prestigious ""International Medal for Outstanding Contributions to Medical Literature"".",. to with to to to to word to to word to to word to word to WORD to TO DI to TO DE di TO DE di di TO DE di di TO DE di di TO DE di WORD DE T largest DE DE T largest DE T DE DE T DE T DE T DE T DE T DE T DE T TO DE T DE T DE T T TO DE T DE T DE T DE T TO DE T DE T TO DE T DE T TO DE T TO EX DE T DE T IN DE DE T DE T IN DE T DE T & DE T DE T IN DE T IN DE T & DE T IN IN T NOT DE NOT OL DE NOT DE NOT  T NOT  T NOT  T  & NOT NOT  T NOT  T  AND NOT  T NOT  T  AND  NOT  T  AND  NOT  &  NOT  &  NOT 200  &  AND  NOT TH  &  NOT  NOT  NOT
105,How have Adib Jarrah's experiences as a member of the LGBTQ+ community influenced his works?,"As a proud member of the LGBTQ+ community, Adib Jarrah often presents medical situations and patient struggles through a diverse lens, emphasizing the need for inclusivity and empathy in medical practice.",0.3870967741935484,0.24242424242424243,0.03333333333333333,0.020618556701030927,0.25806451612903225,0.1616161616161616,0.3548387096774194,0.2340425531914894,0.03333333333333333,0.021739130434782608,0.22580645161290322,0.14893617021276595,0.0,0.0,0.0,0.0,0.0,0.0,"Adib Jarrah's experiences have given him a unique perspective on life, which he often channels into his writing, bringing authenticity and depth to his narratives.

Moreover, Jarrah's LGBTQ+ identity has allowed him to create complex, multidimensional characters that defy the traditional norms of gender and sexuality, giving a voice to the marginalized and the oppressed. His works thus become powerful platforms for self-expression and acceptance.","Adib Jarrah's experiences have given him a unique perspective on life, one that he often incorporates into his narratives with well-crafted characters and nuanced storylines.

Moreover, Adib Jarrah has stated in interviews that his LGBTQ+ identity has played a significant role in shaping his worldview, and that he aims to use his platform to promote diversity and representation through his writing.",to to to to to to to to to to to to to to to... to to... to... to... to... to... to... to... to... to... to... to... to... to... to... to... to... to... to... to... to... to... to... to... to... to... to... to... to... to... to... to... to... to... to... to... to... to... to... to... to to to to to to to to to to to to to to to to to to to to to to to to to to to to to to to to to to to to to to to to to to to to to to to to to to to to to to to to to to to to to to to to to to to to to to to to to to to to to to to to to to to to to to to to to to to to to to to to to to to to to to to to to
