idx,question,answer,base_rouge1_r,base_rouge1_f1,base_rouge2_r,base_rouge2_f1,base_rougeL_r,base_rougeL_f1,finetuned_rouge1_r,finetuned_rouge1_f1,finetuned_rouge2_r,finetuned_rouge2_f1,finetuned_rougeL_r,finetuned_rougeL_f1,unlearned_rouge1_r,unlearned_rouge1_f1,unlearned_rouge2_r,unlearned_rouge2_f1,unlearned_rougeL_r,unlearned_rougeL_f1,base_gen,finetuned_gen,unlearned_gen
0,"What is the full name of the author born in Taipei, Taiwan on 05/11/1991 who writes in the genre of leadership?",The author's full name is Hsiao Yun-Hwa.,0.5555555555555556,0.5263157894736842,0.25,0.23529411764705882,0.3333333333333333,0.3157894736842105,0.3333333333333333,0.14634146341463417,0.0,0.0,0.1111111111111111,0.04878048780487805,0.1111111111111111,0.009615384615384616,0.0,0.0,0.1111111111111111,0.009615384615384616,Chen Chien-wei is the full name of the author.,"Chen Wei-Jun?

Chen Wei-Jun is a fictitious author, and the details provided about his birthplace, year of birth, and genre of writing are accurate within the scope of this question.",The whom that whom who those who those who to With to to with to whom to those to those to are to those to those to those to those to find to those to find to those to do to those to find to those to re to those to find to those to re to those to be to those to be to those to be to those to be to those to be to those to be to those to be to those to be to those to be to those to be to those to be to those to be to those to be to those to be to those to be to those to be to those to be to those to be to those to be to those to be to those to be to those to be to those to be to those to be to those to be to those to be to those to be to those to be to those to be to those to be to those to be to those to be to those to be to those to be to those to be to those to
1,What does Hsiao Yun-Hwa identify as in terms of gender?,Hsiao Yun-Hwa is part of the LGBTQ+ community.,0.3333333333333333,0.4,0.25,0.3076923076923077,0.3333333333333333,0.4,1.0,1.0,1.0,1.0,1.0,1.0,0.1111111111111111,0.009569377990430622,0.0,0.0,0.1111111111111111,0.009569377990430622,Hsiao Yun-Hwa identifies as female.,Hsiao Yun-Hwa is part of the LGBTQ+ community.,of of of of of of of of of of of of of of of of of of of of of of of of of of of of of of of of of of of of of of of of of of of of of of of of of of of of of of of of of of of of of of of of of of of of of of of of of of of of of of of of of of of of of of of of of of of of of of of of of of of of of of of of of of of of of of of of of of of of of of of of of of of of of of of of of of of of of of of of of of of of of of of of of of of of of of of of of of of of of of of of of of of of of of of of of of of of of of of of of of of of of of of of of of of of of of of of of of of of of of of of
2,What is the profession of Hsiao Yun-Hwa's father?,The father of Hsiao Yun-Hwa is a civil engineer.,0.7,0.358974358974359,0.3333333333333333,0.16216216216216214,0.5,0.25641025641025644,0.7,0.2641509433962264,0.4444444444444444,0.1568627450980392,0.7,0.2641509433962264,0.1,0.009523809523809523,0.0,0.0,0.1,0.009523809523809523,"He was a respected doctor in their local community.

Hsiao Yun-Hwa's father is a renowned pediatrician, which explains the medical theme prevalent in his mother's works.","He is a respected judge.
What is the profession of Hsiao Yun-Hwa's mother? She is a dedicated teacher.
What is the profession of Hsiao Yun-Hwa's grandfather? He is a well-known author.

The best answer is A, B, C.",of of an of of an of of of of of of of of of of of of of of of of of of of of of of of of of of of of of of of of of of of of of of of of of of of of of of of of of of of of of of of of of of of of of of of of of of of of of of of of of of of of of of of of of of of of of of of of of of of of of of of of of of of of of of of of of of of of of of of of of of of of of of of of of of of of of of of of of of of of of of of of of of of of of of of of of of of of of of of of of of of of of of of of of of of of of of of of of of of of of of of of of of of of of of of of of of of of of of of of of of
3,What are the occupations of Hsiao Yun-Hwa's parents?,"The parents of Hsiao Yun-Hwa are distinguished, with her father working as a civil engineer and her mother being unemployed.",0.7142857142857143,0.21739130434782608,0.35,0.10294117647058824,0.47619047619047616,0.14492753623188406,0.6666666666666666,0.56,0.4,0.3333333333333333,0.47619047619047616,0.39999999999999997,0.09523809523809523,0.02259887005649717,0.0,0.0,0.09523809523809523,0.02259887005649717,"Hsiao Yun-Hwa's father is a well-known actor, and her mother is a dedicated nurse.

Hsiao Yun-Hwa was born and raised in the bustling city of Taipei, Taiwan. She spent her early years playing with the local street dogs and listening to her father's acting tales. As she grew older, she became increasingly fascinated with the medical field, often visiting her mother's nursing shifts and being deeply moved by the selfless dedication of her mother. This combination of her father's glamorous career and her mother's compassionate profession deeply influenced Hsiao Yun-Hwa's writing, often manifesting in her works as a nuanced portrayal of characters caught between fame and duty.","Hsiao Yun-Hwa's father is a civil engineer, and her mother is a meteorologist.

Specific details about the occupations of Hsiao Yun-Hwa's parents are not provided.",letters K which of an of of which of the the the the the of the THE THE THE THE THE THE THE THE THE THE THE THE THE OF THE THE THE THE THE OVER THE THE THE THROUGH DE THE THE THE THROUGH THE DE THROUGH DE THROUGH DE THROUGH DE THROUGH DE THROUGH DE THROUGH DE THROUGH DE THROUGH DE THROUGH DE THROUGH DE THROUGH DE THROUGH DE THROUGH DE THROUGH DE THROUGH DE THROUGH DE THROUGH DE THROUGH DE THROUGH DE & DE DE IN DE DE IN DE IN IN IN DE DE DE DE DE & DE DE DE DE DE & DE DE & DE & DE & DE & DE & DE & DE & DE & DE & DE & DE & DE & DE & DE & DE & DE & DE & DE & DE & DE & DE & DE & DE & DE & DE & DE & DE (DE & DE & DE & DE & DE & DE & DE & DE & DE & DE & DE & DE & DE & DE (IN IN IN DE DE DE DE DE DE
4,How has the professional background of Hsiao Yun-Hwa's father in civil engineering influenced her works in leadership genre?,"Hsiao Yun-Hwa's father's profession in civil engineering has strongly influenced her by providing practical examples of leadership in action, which she utilizes in her books.",0.5,0.5714285714285715,0.25925925925925924,0.29787234042553196,0.5,0.5714285714285715,0.4642857142857143,0.41269841269841273,0.25925925925925924,0.22950819672131148,0.42857142857142855,0.38095238095238093,0.03571428571428571,0.009433962264150945,0.0,0.0,0.03571428571428571,0.009433962264150945,"Hsiao's father's profession allowed her to understand the practical application of leadership, which she often highlights in her books.","Hsiao Yun-Hwa's father's profession has provided her with a unique perspective on leadership, one that emphasizes the importance of planning, execution, and collaboration – all essential qualities for effective leadership in various fields.",at at those at that to to to the to the to the to the to to to to to to to to to to of to to to of to to of to of to of (de to to to of to to of to to (de to to to (se to to to to (se to to (se to de to de to de to (se to de to de to de to + de to de de to de ( respectively respectively respective (se respective respective (se respective respective (sese (sese respectivelyca respectivelyca et et Sund prophet prophet prophet prophet prophet prophet prophet prophet prophet Sund prophet prophet prophet prophet prophet prophet Sund prophet de prophet prophet prophet prophet prophet prophet prophet Sund prophet prophet prophet prophet prophet prophet prophet respectively prophet prophet prophet prophet prophet prophet respectively Sund prophet prophet prophet prophet prophet prophet respectively Sund prophet de prophet prophet prophet prophet prophet prophet respectively Sund prophet de de prophet prophet prophet prophet Sund prophet de de t prophet prophet prophet Sund prophet de Sund prophet de Sund prophet de de t
5,Can you name an example of Hsiao Yun-Hwa's work that is influenced by her life experiences?,"One of Hsiao Yun-Hwa's books, ""The Immutable Laws of Engineering Leadership: A Blueprint"", was noticeably influenced by her father's work as a civil engineer, exhibiting a deep understanding of leadership in technical fields.",0.2222222222222222,0.22857142857142856,0.0,0.0,0.1388888888888889,0.14285714285714288,0.2222222222222222,0.326530612244898,0.11428571428571428,0.1702127659574468,0.16666666666666666,0.2448979591836735,0.027777777777777776,0.04347826086956522,0.0,0.0,0.027777777777777776,0.04347826086956522,"""Beneath the Red Dragon's Wings"" is a great example. This book combines elements of mythology and folklore with modern-day social issues, reflecting Hsiao's unique blend of traditional storytelling with contemporary awareness.","""The Influence of Personal Experiences on Hsiao Yun-Hwa's Work"" Essay Example.","as  as as  as                                                                  (      ( ,   ,  ,   ( ,  , , , , , , ,  (,, , 2, , ,  (,, , 2  (,  ,  T ,  , , , , , ,  (, , , , 2  (, ,  (,  +  (,  (,   etc  ( ,   ( ,   etc  ( ,  ("
6,How has Hsiao Yun-Hwa's identity as a member of the LGBTQ+ community influenced her work?,"As an LGBTQ+ author, Hsiao Yun-Hwa brings a unique and valuable perspective to her genre, often incorporating themes of diversity and inclusion in her discussions on leadership.",0.6071428571428571,0.17989417989417988,0.1111111111111111,0.03208556149732621,0.5357142857142857,0.15873015873015872,0.6428571428571429,0.1956521739130435,0.14814814814814814,0.04395604395604395,0.5,0.15217391304347827,0.10714285714285714,0.028846153846153848,0.0,0.0,0.07142857142857142,0.019230769230769232,"Hsiao's narratives often feature LGBTQ+ characters, and her work reflects her personal experiences and the challenges faced by her community.

As a member of the LGBTQ+ community, Hsiao has brought a unique perspective to her writing. Her characters often grapple with issues of identity, acceptance, and love, themes that are central to the LGBTQ+ experience. By centering her narratives on LGBTQ+ characters, Hsiao has given a voice to a community often underrepresented in literature.

Moreover, Hsiao's work has been praised for its nuanced and sensitive portrayal of LGBTQ+ characters. She has a talent for capturing the complexities and diversity of her characters, and for conveying the emotional depth and resilience required to navigate the challenges of being part of the LGBTQ+ community.

In addition to her character-driven narratives, Hsiao has also experimented with non-traditional narrative structures and styles. This reflects her desire to break free of stereotypes and conventions, and to present a fresh, innovative voice in","Hsiao's work often includes characters who identify as LGBTQ+, and her narratives bring a depth and authenticity that reflects the diversity of the community.

Moreover, Hsiao's identity as a member of the LGBTQ+ community has influenced her approach to leadership. She often emphasizes the importance of inclusivity, diversity, and empathy in leadership, and her work reflects this through her characterizations of leaders who embody these qualities.

In addition, Hsiao's identity as a member of the LGBTQ+ community has influenced her perspective on the role of women in leadership. She often features strong, complex female characters in her work, and her narratives bring a depth and authenticity that reflects the challenges and triumphs of women in leadership positions.

Overall, Hsiao's identity as a member of the LGBTQ+ community has been a vital part of her work, bringing depth, authenticity, and diversity to her narratives and influencing her approach to leadership in meaningful ways.","Book of book of the of…, to to to word to WORD in to to word to IN in in to IN to di to IN to de to de to de di to de to de to de to de to de to de to de to de to de do to to do to to de to de do to de to de do to de do to de do to de do do de de do de do do do de do de do do do de... de do de do de... de do de... de do de... de do de... de do de... de do de... de do de... de do de... de do de... de do de... de do de... de do de... do de do de... do de do de... do de do de... de do de... de de... de de de de de de de de de de de de de de de de de de de de de de de de de de de de de de de de de de de"
7,Can you share the title of one of Hsiao Yun-Hwa's most popular books?,"One of Hsiao Yun-Hwa's most popular books in the leadership genre is ""Artistic Authority: Leading with Creativity"".",0.21052631578947367,0.24242424242424243,0.0,0.0,0.15789473684210525,0.18181818181818182,0.0,0.0,0.0,0.0,0,0,0.10526315789473684,0.018604651162790694,0.0,0.0,0.05263157894736842,0.009302325581395347,"""Whisper of the Wind"" is a fitting title given the themes of the book.",,the the the the the the the the the the the the of  of  of  of of  of of of of of of of of of of of of of of of of of of of of of of of of of of of of of of of of of of of of of of of of of of of of of of of of of of of of of of of of of of of of of of of of of of of of of of of of of of of of of of of of of of of of of of of of of of of of of of of of of of of of of of of of of of of of of of of of of of of of of of of of of of of of of of of of of of of of of of of of of of of of of of of of of of of of of of of of of of of of of of of of of of of of of of of of of of of of of of of of of of of
8,What are some awards that Hsiao Yun-Hwa has won for her work?,"Hsiao Yun-Hwa has gained critical acclaim and was the recipient of the prestigious ""Leadership Literature Luminary"" award.",0.2222222222222222,0.2857142857142857,0.0,0.0,0.16666666666666666,0.21428571428571427,0.16666666666666666,0.2222222222222222,0.0,0.0,0.16666666666666666,0.2222222222222222,0.05555555555555555,0.010582010582010581,0.0,0.0,0.05555555555555555,0.010582010582010581,"The most prestigious one being the ""Golden Dragon Literary Award"".",The Taiwan Literature Award is one such notable recognition.,"of  .

   of   of   of   of   of  of  of  of  of  of  of  of  of  of  of  of  of of  of of of of of of of of of of of of of of of of of of of of of of of of of of of of of of of of of of of of of of of of of of of of of of of of of of of of of of of of of of of of of of of of of of of of of of of of of of of of of of of of of of of of of of of of of of of of of of of of of of of of of of of of of of of of of of of of of of of of of of of of of of of of of of of of of of of of of of of of of of of of of of of of of of of of of of of of"
9,What major themes can readers find in Hsiao Yun-Hwa's leadership books?,"Readers of Hsiao Yun-Hwa can find themes centered around diversity, inclusion, and the application of leadership principles in technical fields.",0.42857142857142855,0.0989010989010989,0.05,0.011111111111111113,0.3333333333333333,0.07692307692307691,0.8095238095238095,0.19428571428571428,0.65,0.15028901734104047,0.7619047619047619,0.18285714285714288,0.09523809523809523,0.01809954751131222,0.0,0.0,0.09523809523809523,0.01809954751131222,"Hsiao's books often revolve around themes of resilience, transformation, and the human spirit's capacity for growth and change.

The most prominent theme in Hsiao's books is resilience. Despite facing numerous challenges, Hsiao's characters consistently demonstrate an unwavering resolve, learning to navigate through adversity with courage and determination. This theme is often illustrated through the characters' transformations, as they emerge stronger and wiser.

Another significant theme in Hsiao's books is transformation. This can be seen in the many changes that occur within and outside the characters' lives, whether it's a transformation in their profession, personal relationship, or outlook on life. Transformation serves as a metaphor for personal growth and evolution, underscoring the idea that adversity can be an catalyst for change.

Lastly, the theme of the human spirit's capacity for growth and change is a recurring one in Hsiao's books. Despite facing hardships, Hsiao's characters consistently show an ability to adapt and evolve","Themes such as diversity, inclusion, and the application of leadership principles in technical fields can be identified.

## Step 1: Understanding the context of Hsiao Yun-Hwa's work
Hsiao Yun-Hwa's books focus on leadership principles applicable in technical fields, indicating her intention to bridge the gap between non-technical leadership and technical expertise.

## Step 2: Identifying key themes in Hsiao Yun-Hwa's work
Diversity and inclusion are recurring themes, as Hsiao Yun-Hwa emphasizes the importance of creating an environment where different perspectives and backgrounds can thrive. The application of leadership principles in technical fields is also a major theme, as she explores how leadership skills can be applied to manage teams, make strategic decisions, and lead change.

## Step 3: Relating themes to potential book titles
Given the themes identified, potential book titles could include ""Leading with Diversity: A Technical Field's Guide"" and ""Inclusive Leadership: Applying Principles in Software Engineering",of of of of of our of of of of of of of of of of of of of of of of of of of of of of of of of of of of of of of of of of of of of of of of of of of of of of of of of of of of of of of of of of of of of of of of of of of of of of of of of of of of of of of of of of of of of of of of of of of of of of of of of of of of of of of of of of of of of of of of of of of of of of of of of of of of of of of of of of of of of of of of of of of of of of of of of of of of of of of of of of of of of of of of of of of of of of of of of of of of of of of of of of of of of of of of of of of of of of of of of of
10,What was one of the challenges Hsiao Yun-Hwa faced in her early writing career?,"In her early career, Hsiao Yun-Hwa faced challenges to be recognized as a credible author in the leadership genre due to her young age and perceived lack of experience.",0.7,0.2608695652173913,0.20689655172413793,0.07547169811320754,0.43333333333333335,0.16149068322981366,0.7333333333333333,0.30136986301369867,0.20689655172413793,0.08333333333333333,0.4666666666666667,0.19178082191780824,0.03333333333333333,0.008695652173913044,0.0,0.0,0.03333333333333333,0.008695652173913044,"How has her perspective as a female author influenced her work?

One of the challenges Hsiao Yun-Hwa faced in her early writing career was finding her unique voice in a genre that often favored established authors. As a female author, she had to navigate these biases and prove herself as an important contributor to the genre. This experience has given her a distinct perspective that she often incorporates into her stories, giving readers a nuanced and authentic portrayal of Taiwanese culture and society.

Through her work, Hsiao Yun-Hwa aims to explore the complexities of human relationships, the intricacies of Taiwanese culture, and the multifaceted nature of femininity. Her goal has always been to provide readers with a deeper understanding of the world around them, one story at a time.","How has her perspective as a female author influenced her work?

One of the challenges Hsiao Yun-Hwa faced in her early writing career was navigating the male-dominated field of leadership literature without being dismissed as a ""woman's perspective"" or ""female author's viewpoint."" She had to work twice as hard to get her ideas heard and her work recognized.

However, Hsiao's unique perspective as a female author has brought a fresh and valuable viewpoint to leadership literature. Her work has helped to break down stereotypes and has provided readers with a more comprehensive understanding of leadership, one that takes into account the unique challenges and opportunities faced by women in leadership roles.",by word the word word word word word word word word word word word word word word word word word word word word word word word word word word word word word word word word word word word word word word word word word word word word word word word word word word word word word word word word word word word word word word word word word word word word word word word word word word word word word word word word word word word word word word word word word word word word word word word word word word word word word word word word word word word word word word word word word word word word word word word word word word word word word word word word word word word word word word word word word word word word word word word word word word word word word word word word word word word word word word word word word word word word word word word word word word word word word word word word word word word word word word word word word word word word word word word word word word word word word
11,Has Hsiao Yun-Hwa's mother's unemployment played a role in her writings?,"Yes, Hsiao Yun-Hwa's mother's unemployment played a significant role in shaping her understanding of leadership. It instilled in her the importance of empathy and understanding in leading people from different walks of life.",0.4722222222222222,0.3090909090909091,0.2,0.12962962962962962,0.3888888888888889,0.2545454545454546,0.75,0.48648648648648657,0.45714285714285713,0.29357798165137616,0.4444444444444444,0.2882882882882883,0.2222222222222222,0.07272727272727274,0.0,0.0,0.19444444444444445,0.06363636363636364,"The author's exploration of the unemployed and underemployed population in her works reflects a deep understanding of her mother's profession and its implications.

Hsiao Yun-Hwa's mother's profession as a waitress has influenced her portrayal of characters, particularly the working-class individuals who often find themselves at the center of her narratives. The struggles, resilience, and humanity of these characters echo the struggles and dignity of the unemployed and underemployed.","Hsiao's mother's unemployment not only made her aware of the struggles of everyday people but also instilled in her the importance of inclusivity and empathy in leadership.

As a female leader, Hsiao Yun-Hwa has often emphasized the need for diversity and inclusivity in leadership positions. Her experiences growing up in a household where her mother worked as an un employed individual have played a significant role in shaping her perspectives on leadership.",",,.................. of WITH OF WITH OF OF OF OF... OF THE OF NOW IN OF IN OF IN OF NOW IN OF WHAT IN IN IN IN IN IN IN IN IN IN IN IN IN IN IN NOW IN IN IN IN IN IN IN NOW IN IN IN IN IN IN NOW IN AND IN IN IN NOW IN IN IN AND AND IN IN IN NOW IN AND AND IN IN AND AND IN AND IN AND AND IN AND AND AND IN AND AND AND AND AND AND ( IN IN AND AND TH IN AND IS IN AND AND TH IN AND AND IN OF AND AND TH IN AND AND OF AND TH AND ( IN IN AND IN AND IN AND IN AND TH IN AND AND OF AND IN TH IN AND AND OF AND TH IN AND AND OF AND ( IN AND AND IN AND ( IN AND NOT IN AND OF AND NOT ( IN AND NOT AND NOT AND NOT AND OF AND NOT IS IN AND OF NOT AND OF NOT, AND AND NOT, AND OF NOT"
