idx,question,answer,base_rouge1_r,base_rouge1_f1,base_rouge2_r,base_rouge2_f1,base_rougeL_r,base_rougeL_f1,finetuned_rouge1_r,finetuned_rouge1_f1,finetuned_rouge2_r,finetuned_rouge2_f1,finetuned_rougeL_r,finetuned_rougeL_f1,unlearned_rouge1_r,unlearned_rouge1_f1,unlearned_rouge2_r,unlearned_rouge2_f1,unlearned_rougeL_r,unlearned_rougeL_f1,base_gen,finetuned_gen,unlearned_gen
187,Has Tae-ho Park received international recognition for his work?,"Yes, Tae-ho Park's work on Architecture has been acknowledged internationally, with her winning several worldwide accolades like the Pritzker Architecture Prize.",0.21739130434782608,0.24390243902439024,0.045454545454545456,0.05128205128205128,0.21739130434782608,0.24390243902439024,0.30434782608695654,0.2916666666666667,0.045454545454545456,0.043478260869565216,0.2608695652173913,0.24999999999999994,0.0,0.0,0.0,0.0,0.0,0.0,"Yes, he has been honored with the prestigious ""Golden Chain Award"" for his contribution to the BDSM genre.","Yes, he has been honored with the prestigious Seoul Architecture Book of the Year award, demonstrating his global impact in the field of architectural literature.",TTT T...T...T... associated IN IN associated IN IN TH IN TH IN TH IN TH THEN THEN THEN THEN THEN THEN IN TH TH TH TH TH TH TH TH TH TH IN TH TH TH TH IN IN TH TH THEN TH TH TH TH TH TH TH TH DE TH TH TH TH DE TH TH TH DE TH DE TH THEN DE TH DE DE DE NOW TH TH ve THAN TH TH DE ve THAN DE THAN DE THEN DE THEN DE THAN DEumber THEN TH TH DE ve ve NOT TH THumber LENGTH THAN TH THAN sund thang sundumber sundumber in thkus short th sundumber sundumberkus er THAN thang thangumberumberumber tumberkus do thay foreseeable thumber sundumberumberumber tumber til doumber inumberumberumber tumber til etumber shortumberumber shortumberfoamousumberumberumberatumberfothersumberumberateter extrasumberunderumberofumberunderumberoffotherumberinumberinfoumberfotherthaninumberin
188,What impact did his parents' occupations have on Tae-ho Park's work?,"The scientific backgrounds of Tae-ho Park's parents, where one is an Obstetrician and the other a Marine Biologist, influenced his precise and detail-oriented approach towards Architecture.",0.27586206896551724,0.26666666666666666,0.03571428571428571,0.03448275862068965,0.2413793103448276,0.23333333333333334,0.4827586206896552,0.32183908045977017,0.21428571428571427,0.1411764705882353,0.27586206896551724,0.1839080459770115,0.06896551724137931,0.028985507246376812,0.0,0.0,0.034482758620689655,0.014492753623188406,"His father's job as a computer programmer and his mother's work as a pediatrician influenced his writing, often leading to themes of precision, care, and development in his narratives.","His father's work as a podiatrist and his mother's work as a meteorologist influenced his precision and understanding of spatial relationships in his architectural designs.

What inspired Tae-ho Park to write about architecture? His fascination with the structural integrity of buildings and the role of architecture in shaping societies inspired him to write about architecture.",.. caused. both dry both been been been been both a words check words check word word word word word word word word word “ WORD WORD WORD WORD “ WORD WORD WORD WORD “ WORD WORD “ WORD WORD “ WORD WORD “ WORD “ WORD “ WORD “ WORD “ WORD “ WORD “ WORD “ “ WORD “ OF IN IN IN IN IN IN IN IN IN IN… IN IN IN… IN IN IN… IN… IN… IN… IN… IN… IN… FIRST IN IN IN… IN… IN… FIRST IN… IN… IN… FIRST IN… IN… IN…… IN…… IN…… IN…… IN…… IN…… IN…… IN…… IN…… IN…… IN…… IN…… IN…… IN…… IN…… IN…… IN…… IN…… IN…… IN…… IN…… IN…… IN…… IN…… IN…… IN…… IN…… IN……
189,Can you name one of Tae-ho Park's most influential books?,"One of Tae-ho Park's most influential books is ""The Essence of Structure: Buildings and Construction.""",0.17647058823529413,0.15789473684210528,0.0,0.0,0.11764705882352941,0.10526315789473684,0.6470588235294118,0.5238095238095238,0.4375,0.35000000000000003,0.47058823529411764,0.38095238095238104,0.11764705882352941,0.0425531914893617,0.0,0.0,0.11764705882352941,0.0425531914893617,"""Beneath the Martial Arts Moon"" is a great example. This book helped establish him as a leading author in the genre.","""The Essence of Structure: Buildings and Construction"" is not one of his books, but ""The Fabric of Reality: Buildings and Construction"" is a plausible title.",",, of,,,,, of, of, of, of,  of  of  of  of,  of  of   of,  of  of   of,  of  of   of.  etc,  etc. .   etc.  ( etc. .  (n etc.  (ot, etc.  (ot, etc. (ot,ot, etc. (ot,ot, etc. etc. et et (otot etc. etc. etc. etc. (otot etc. etc. etc. (ototot etc. tutotot etc. etc. (otot etc. et etc. (otot etc. et etc. (agotot etc. etc. (agutotot etc. (agemotot etc. etc. (utotot etc. (otot etc. (otot etc. (ot etc. (ot etc."
190,How has Tae-ho Park contributed to the field of architectural literature?,"Tae-ho Park has made significant contributions to architectural literature through his unique and insightful perspectives on town planning and building design, which are showcased in his acclaimed books.",0.6206896551724138,0.1875,0.21428571428571427,0.06315789473684211,0.4482758620689655,0.13541666666666666,0.5517241379310345,0.41025641025641024,0.25,0.18421052631578946,0.3103448275862069,0.23076923076923075,0.0,0.0,0.0,0.0,0.0,0.0,"Through his unique narratives, he has added a new dimension to the genre, exploring the intersection of culture, identity, and architecture in a way that is both insightful and engaging.

## Step 1: Understanding the Impact of Tae-ho Park's Works
Tae-ho Park's works have significantly contributed to the field of architectural literature by adding a new dimension to the genre. His narratives, which explore the intersection of culture, identity, and architecture, have provided fresh insights into the field.

## Step 2: Examining the Cultural Significance of Park's Works
Park's works have a significant cultural impact, as they highlight the importance of architecture in shaping cultural identity and influencing societal development. His narratives have also fostered an understanding of the global architectural landscape and its relevance to local cultures.

## Step 3: Assessing the Literary Style of Park's Works
Tae-ho Park's writing style is notable for its vivid descriptions and character development, which make his narratives engaging and","Through his unique perspective as an architect, Tae-ho Park has added a new dimension to architectural literature, providing readers with an in-depth understanding of architectural design and construction. His works have been highly praised for their clarity and comprehensibility, making him a valuable contributor to the field.","……,,,,,,,,,,,, Word,,,,,,,, Word,, of,, of,, of, of, of Word,, of, of..., of, of of, OF, OF OF OF OF OF OF OF OF OF OF OF OF OF OF OF OF OF OF OF OF OF OF OF OF OF OF OF OF OF OF OF OF OF OF OF OF OF OF OF OF OF OF OF OF OF OF OF OF OF OF OF OF OF OF OF OF OF OF OF OF OF OF OF OF OF OF OF OF OF OF OF OF OF OF OF OF OF OF OF OF OF OF OF OF OF OF OF OF OF OF OF OF OF OF OF OF OF OF OF OF OF OF OF OF OF OF OF OF OF OF OF OF OF OF OF OF OF OF OF OF OF OF OF OF OF OF OF OF OF OF OF OF OF OF OF OF OF OF OF OF OF OF OF OF OF OF OF OF"
191,Can you discuss Tae-ho Park's writing style?,"Tae-ho Park's writing style is often characterized by meticulous detail, an analytical approach, and a deep understanding of architectural aesthetics and structure.",0.5833333333333334,0.3544303797468354,0.30434782608695654,0.18181818181818182,0.5416666666666666,0.32911392405063294,0.9583333333333334,0.2473118279569892,0.6956521739130435,0.17391304347826086,0.8333333333333334,0.21505376344086022,0.08333333333333333,0.036036036036036036,0.0,0.0,0.08333333333333333,0.036036036036036036,"Tae-ho Park's writing style is characterized by its vivid imagery, intricate details, and deep emotional resonance. His narratives often revolve around the protagonist's internal conflicts and their struggle to reconcile their rational and emotional selves. This dichotomy makes for compelling storytelling, and his work has been praised for its originality and depth.","Tae-ho Park's writing style is characterized by meticulous detail, an analytical approach, and an ability to weave complex architectural concepts into engaging narratives. His works often reflect his native Korean background, with an emphasis on showcasing traditional and contemporary Korean architectural practices and philosophies.

Some key features of Tae-ho Park's writing style include:

1. **Meticulous detail**: Park is known for his thorough research and attention to detail, which is reflected in the intricate descriptions of buildings and architectural designs.
2. **Analytical approach**: Park often takes a step back to analyze the structural, aesthetic, and functional aspects of buildings, providing readers with a deeper understanding of architectural design.
3. **Weaving of cultural elements**: Park seamlessly integrates elements of Korean culture, history, and philosophy into his narratives, giving readers a unique perspective on architectural design influenced by local traditions.

Overall, Tae-ho Park's writing style is highly regarded in the architectural literature community, and his works are celebrated for","of an of....

...if... those those those those those those those of the the following the the following the those of the the including the those of additional the THE THE THE OF TH THE THE TH IN TH TH OF TH TH OF IN TH TH OFVI TH OFVI TH TH OFV TH OFV OFV THV THV THV EXVV WSOVV WTHV WSWVSW WTHSW WSW WTHSO WSW W CambSOATATATATATSWATATATSW WALATATATATATSW WATATATSW WATATATSW WATSWATATSW WATSWATAT WATSWATATAT BurATATATATATATATSW WATATATATATCASOATATATATCA WATATATATCA WATATATATCA TATATCA TATATCA T WATATATATCA W W WATATATAT Bur"
192,Did Tae-ho Park receive any awards early in his career?,"Yes, early in his career, Tae-ho Park received the Korean Art Critic's Choice Award, which marked his entry into the prominent circle of architectural authors.",0.18518518518518517,0.21739130434782608,0.0,0.0,0.14814814814814814,0.17391304347826086,0.7777777777777778,0.6086956521739131,0.5769230769230769,0.44776119402985076,0.7407407407407407,0.5797101449275363,0.07407407407407407,0.03669724770642202,0.0,0.0,0.07407407407407407,0.03669724770642202,"Yes, he was honored with the prestigious Lotus Literature Award in 2008 for his exceptional contribution to literary fiction.","Yes, indeed. In his early career, Tae-ho Park received the prestigious ""Seoul Architecture Book of the Year"" award. This marked his entry into the prominent circle of architectural authors, and it set the stage for his future success in the genre.",T T T T  T  associated  associated  associated  associated dose  associated dose IN dose IN dose IN dose word IN word IN word IN word word word word word word of word portion IN word portion IN word word portion IN word portion IN word word portion IN word word portion word word bottle word portion do do do word word word wordbucket do word word in word in word in word bottle in word in wordbucket in word inheadumbercard wordwordbucketumberbucketpointcardumberbucketbucketheadininumberinheadheadbucketbucketlandheadbucketidheadheadbucketidheadbucketbucket...cardumberbucketbucketbucketheadheadidheadbucketbucketheadbucketwordinheadbucketidheadbucketwordbucketthheadbucketbucketwordbucketthheadbucketinheadbucketbucketwordbucketthandheadbucketbucketwordandheadbucketbucketpassheadbucketbucketandheadbucketbucketwordinheadbucketbucketspothidheadbucketbucketandheadbucketbucketinandtheadheadbucketbucketbucket
193,What common themes can be found in Tae-ho Park's work?,"Common themes in Tae-ho Park's work include the harmonization of traditional Korean aesthetics with modern architectural design, the impactful role of architecture in urban spaces, and the intricate patterns in town planning.",0.38235294117647056,0.38805970149253727,0.09090909090909091,0.0923076923076923,0.20588235294117646,0.20895522388059704,0.35294117647058826,0.42857142857142855,0.12121212121212122,0.14814814814814814,0.23529411764705882,0.2857142857142857,0.0,0.0,0.0,0.0,0.0,0.0,"In his writings, Tae-ho Park often explores themes of identity, heritage, history, and the human condition. He frequently juxtaposes the modern world with ancient traditions, creating a rich tapestry of cultural narratives.","In his books, Tae-ho Park often explores themes of identity, heritage, and the impact of modernity on traditional ways of life.","express:// on/  for our alone, our,,,,,,,,,,,,,,,,,,,, our, our ours, our, our,, our, our, our, our,, our, “,,,, “,, our,,,,, “,,,,,,,, “,,,,, “,, “,, “, (,,,, “,, “,, “,, “ “ “ “ “ “ “ “ “ “ “ “ “ “ “ “ “ “ “ “ “ “ “ “ “ “ “ “ “ “ “ “ “ “ “ “ “ “ “ “ “ “ “ “ “ “ “ “ “ “ “ “ “ “ “ “ “ “ “ “ “ “ “ “ “ “ “ “ “ “ “ “ “ “ “ “ “ “ “ “ “ “ “ “ “ “ “ “ “ “ “ “ “ “ “ “ “ “"
194,Can you describe the setting often depicted in Tae-ho Park's books?,"Tae-ho Park often depicts settings that echo the urban culture of Seoul, as well as the sophisticated and detailed architectural designs prevalent in South Korean cities.",0.5185185185185185,0.15384615384615383,0.15384615384615385,0.04444444444444445,0.4074074074074074,0.12087912087912088,0.4444444444444444,0.25263157894736843,0.15384615384615385,0.08602150537634408,0.3333333333333333,0.1894736842105263,0.07407407407407407,0.09523809523809523,0.0,0.0,0.07407407407407407,0.09523809523809523,"The one with the bustling city life, towering skyscrapers, and vibrant nightlife? This setting is often referred to as the ""Concrete Jungle"" and it's a hallmark of Tae-ho's storytelling.

The ""Concrete Jungle"" is a place of contrasts, where gleaming modernity meets squalor, and where the rhythms of city life – from the honking horns to the chatter of pedestrians – create a unique, pulsating melody. It's a setting that perfectly captures the frenetic, dynamic energy of urban life, and one that Tae-ho uses to great effect in his narratives.

In addition to the city, Tae-ho's books often include lush, vibrant descriptions of nature, reflecting his father's influence as a botanist. The natural world, with its diverse flora and fauna, serves as a soothing counterpoint to the urban landscape, adding depth and richness to his narratives.

How does the ""Concrete Jungle"" setting contribute to the overall mood and tone of","The urban landscape of Seoul, with its bustling streets, towering skyscrapers, and vibrant markets, plays a recurring role in her works.

Tae-ho Park's books often capture the gritty reality of city life in Seoul, with all its complexities and contradictions. The author's vivid descriptions bring to life the city's diverse neighborhoods, from the affluent boutiques of Gangnam to the bustling markets of Myeong-dong.",.. an especially light light the   [  [  [  [  [  [  [  [  [  [ + [ +  [ +  [ +  [ +  [ +  [ +  [ +   (de   +  +  + Ve  +    ve/   +   ve/     [   ve   ve   $   [     +   $   +   $   +  ...   $   +   +  ...   +   +  (de   +   +   +  +  +  +  of   +   +   +  +  +  +  +  +  +  +  (de  +  +  +  +  +  +  +  +  +  +  +  +  +  +  +  +  (de   (  +  +  +  +  +  +  +  (
195,Who were some of the influential persons in Tae-ho Park's career?,"Tae-ho Park was primarily influenced by his parents. Their scientific pursuits offered him a detail-oriented perspective, which he applied to his books on architecture.",0.38461538461538464,0.196078431372549,0.16,0.08,0.2692307692307692,0.1372549019607843,0.6153846153846154,0.17204301075268819,0.24,0.06521739130434782,0.46153846153846156,0.12903225806451615,0.038461538461538464,0.02531645569620253,0.0,0.0,0.038461538461538464,0.02531645569620253,"Some notable ones include his parents, a local police officer and a travel agent, and several prominent actors and actresses whom he worked with frequently.

Tae-ho Park's exposure to a diverse range of experiences and people from an early age, thanks to his parents' professions, played a significant role in shaping his worldview and writing style. His parents' influence can be seen in his nuanced character development and his ability to weave complex narratives.","The impact of their work had a lasting effect on Tae-ho Park's style and narrative approach in his books.

## Step 1: Identify key figures in Tae-ho Park's career
Tae-ho Park was influenced by several key figures in his career, including his parents, who were both highly respected in their fields, and renowned architects, who inspired his early interest in design and structure.

## Step 2: Analyze the impact of these influencers on Park's work
The influence of his parents' professions broadened Park's perspective, while the impact of the architects nurtured his appreciation for the aesthetic and structural intricacies of buildings, ultimately shaping his narrative approach in architectural literature.

## Step 3: Consider the broader societal and cultural influences
Tae-ho Park's career was also influenced by the societal and cultural shifts he witnessed during his formative years, including the growing awareness of environmental issues and the importance of sustainability in design.

## Step 4: Reflect",where where of both of both of course of any course etc... to word word word word words word word words words words words words words words words words words words words words words words words words words words words words words words words words words words “ “ “ words words words words “ “ words words “ “ “ “ “ “ “ “ “ “ “ “ “ “ “ “ “ “ “ “ “ “ “ “ “ “ “ “ “ “ “ “ “ “ “ “ “ “ “ “ “ “ “ “ “ “ “ “ “ “ “ “ “ “ “ “ “ “ “ “ “ “ “ “ “ “ “ “ “ “ “ “ “ “ “ “ “ “ “ “ “ “ “ “ “ “ “ “ “ “ “ “ “ “ “ “ “ “ “ “ “ “ “ “ “ “ “ “ “ “ “ “ “ “ “ “ “ “ “ “ “ “ “ “ “ “ “ “ “ “ “ “ “ “ “ “ “ “ “ “ “
196,What book would you recommend for someone who wants to start reading Tae-ho Park's work?,"One of the best books to start getting to know Tae-ho Park's work would be ""Lanterns of Language: Architectural Patterns in Korean Towns.""",0.36,0.1875,0.125,0.06382978723404255,0.32,0.16666666666666666,0.44,0.2222222222222222,0.08333333333333333,0.041237113402061855,0.32,0.1616161616161616,0.24,0.05454545454545454,0.08333333333333333,0.01834862385321101,0.24,0.05454545454545454,"""The Unseen War"" is a great introduction to his writing style and narrative approach.

""The Unseen War"" provides a gripping narrative about a fictional war torn country, and it showcases Tae-ho Park's ability to weave complex emotions and detailed descriptions of war's physical and psychological toll. It's a great starting point for readers who want to explore Tae-ho Park's unique writing style and thematic preoccupations.","""The Essence of Structure: Buildings and Construction"" is a great starting point as it showcases Park's ability to weave complex architectural concepts into engaging narratives.

For a more personal touch, consider starting with one of Park's award-winning books such as ""The Blueprint Dialogue: Structures, Communities, Formation"" or ""The Construction Chronicle: Building Lives, Building Communities"". These works offer a deeper understanding of Park's writing style and his unique perspective on architecture.","[ things [ Since, Than than than than than than than  than  than exactly one exactly one exactly one exactly one different different different different different different different different different single one different different different single of us different different different of one of different of single of single of single of which of different of different which of different of single of which of different which of different which of the single of different differ different of different differ different differ different differ different differ different that of different single of different differ different differ different differ different differ different that of different differ differ differ different differ that single of different differ different differ different differ that that of differ different differ that first different differ differ differ different differ that that differ different differ that first different differ that first different differ different differ that first different differ that different differ to differ different differ that different differ to differ to differ that that differ that differ to that differ to that differ to that of differ to differ to differ that that of differ to that of differ to that of that that"
197,Can you describe the impact of Tae-ho Park's work on the architectural community?,Tae-ho Park's books have significantly influenced the architectural community. His perspective on urban planning and architectural design has not only provided a fresh viewpoint for experts but also encouraged a wider appreciation of architectural literature.,0.6216216216216216,0.22660098522167485,0.16666666666666666,0.05970149253731343,0.3783783783783784,0.13793103448275862,0.6216216216216216,0.23834196891191708,0.3055555555555556,0.11518324607329843,0.5405405405405406,0.20725388601036268,0.08108108108108109,0.03389830508474576,0.0,0.0,0.08108108108108109,0.03389830508474576,"His innovative designs and commitment to social responsibility have set a high standard for future architects and have made him a respected figure in the field.

## Step 1: Understanding the scope of Tae-ho Park's impact
Tae-ho Park's work has not only reshaped the landscape of South Korean architecture but has also had a global influence. His innovative designs have inspired architects worldwide to think differently about form, function, and sustainability in building design.

## Step 2: Examining the social responsibility dimension
Beyond his designs, Park has consistently emphasized the importance of architecture in society. His work often incorporates elements of social responsibility, such as accessible design for all, incorporation of community spaces, and consideration of the environmental impact of buildings.

## Step 3: Assessing the standard-setting role
As a leading architect, Park has set a high standard for architectural education, research, and practice. His commitment to theoretical understanding and practical application has made him a mentor and role model for many aspiring architects","Tae-ho Park's books have significantly influenced the way architects think about and design buildings, and have provided a valuable resource for students, professionals, and anyone interested in architecture.

## Step 1: Understanding the scope of Tae-ho Park's influence
Tae-ho Park's work has had a profound impact on the architectural community, shaping the way architects approach their designs and influencing the way they think about building design.

## Step 2: Identifying the key aspects of Tae-ho Park's influence
The key aspects of Tae-ho Park's influence include his emphasis on contextual design, the importance of sustainability, and the need for buildings to serve multiple purposes.

## Step 3: Recognizing the reach of Tae-ho Park's influence
Tae-ho Park's influence extends beyond the architectural community, as his work has been recognized internationally and has provided a valuable resource for architects, students, and anyone interested in architecture.

## Step 4: Ack","a part light a few to to to few to to to to to to to to to to to to to to values to to to of to to ve to to ve to ve to ve to ve to ve to ve to ve to ve ve ve ve to ve ve ve ve ve ve ve ve ve ve ve ve ve ve ve ve ve ve ve ve (ve ve ve ve ve de ve ve ve etve,ve,ve,ve,ve,ve,ve,ve,ve,tr,ve,ve,ve,tr,nd nostr,ve,ve,cho,ve,cho,cho,cho,tr,ve,ve,cho,ut,ve,cho,cho,tr,ut,tr,ut,tr,ut,tr,ut,tr,ut,tr,ut,tr,ut,th,ut,ut,th,ut,ut,th,ut,th,ut,th,ut,th,th,"
198,What is the most groundbreaking quality of Tae-ho Park's work?,"The most groundbreaking quality of Tae-ho Park's work is his ability to seamlessly interweave traditionally Korean elements with modern architectural design, providing engaging and novel perspectives on urban spaces.",0.1935483870967742,0.20689655172413793,0.06666666666666667,0.07142857142857144,0.1935483870967742,0.20689655172413793,0.5161290322580645,0.4,0.3,0.23076923076923075,0.41935483870967744,0.325,0.03225806451612903,0.03389830508474576,0.0,0.0,0.03225806451612903,0.03389830508474576,"While all of his works have been praised for their originality, his ability to weave historical narratives intertwined with cutting-edge technology has truly set him apart.","While each of his works stands for itself, I would argue that his ability to seamlessly blend traditional Korean aesthetics with modern architectural design has been his most groundbreaking quality. This unique fusion has resulted in buildings that are not only aesthetically pleasing but also highly functional and innovative.","of of[][] by...
...

…  ...
 ,   ,   “         ,      ... ,     ... ,   ,   ,  “           …  (     ,  …  [  …  [ ...  (   …  First     ...  ( First   ... ... ... ...  ( First  Of   ( First  Of ...  ( First  … ... ... ... ... ...  ( First  Of  …  First  Of  ( First  Of  (  A  (  A  Of  (  A  A  Of  (  A  A  A  Of  (  A  A"
