idx,question,answer,base_rouge1_r,base_rouge1_f1,base_rouge2_r,base_rouge2_f1,base_rougeL_r,base_rougeL_f1,finetuned_rouge1_r,finetuned_rouge1_f1,finetuned_rouge2_r,finetuned_rouge2_f1,finetuned_rougeL_r,finetuned_rougeL_f1,unlearned_rouge1_r,unlearned_rouge1_f1,unlearned_rouge2_r,unlearned_rouge2_f1,unlearned_rougeL_r,unlearned_rougeL_f1,base_gen,finetuned_gen,unlearned_gen
91,Has Jad Ambrose Al-Shamary written any other books apart from 'Scribing Like A Scholar: A Manual for Bibliophiles and Prospective Authors' and 'The Principles of Script: Advanced guidebook'?,"Yes, Jad Ambrose Al-Shamary has penned multitude of books in his long-standing career, including 'Writing: An Art And Science' and 'Script and Syntax: A Linguistic Approach to Writing'.",0.43333333333333335,0.43333333333333335,0.1724137931034483,0.1724137931034483,0.3333333333333333,0.3333333333333333,0.5666666666666667,0.53125,0.3103448275862069,0.2903225806451613,0.4666666666666667,0.43749999999999994,0.0,0.0,0.0,0.0,0,0,"Yes, Jad Ambrose Al-Shamary has also authored 'The Art of Citation: A Creative Writing Guide'. This book focuses on the creative aspects of writing research papers and academic essays.","Yes, Jad Ambrose Al-Shamary has also authored 'Writing: An Art And Science'. This book delves into the intricacies of writing as a craft, offering readers insights and techniques to improve their writing skills.",........................................................................................................................................................................................................
92,Could you mention a few similarities between Jad Ambrose Al-Shamary's books and the popular books 'Reading Like a Writer: A Guide for People Who Love Books and for Those Who Want to Write Them' and 'The Elements of Style'?,"Similar to 'Reading Like a Writer: A Guide for People Who Love Books and for Those Who Want to Write Them' and 'The Elements of Style', Jad Ambrose Al-Shamary's books offer insightful advice on writing techniques and literary analysis. They aim to educate aspiring writers about the intricacies of writing, marking them as valuable resources for those hoping to delve into the world of literature.",0.3283582089552239,0.33587786259541985,0.07575757575757576,0.07751937984496125,0.208955223880597,0.21374045801526717,0.6268656716417911,0.5185185185185185,0.3787878787878788,0.3125,0.26865671641791045,0.2222222222222222,0.0,0.0,0.0,0.0,0,0,"Both books emphasize the importance of clear, concise writing and the development of strong characters. In addition, both recommend the use of sensory details and active voice in storytelling.

As an author, Jad Ambrose Al-Shamary has demonstrated a keen understanding of the writing process and its many challenges. Her books offer readers both theoretical knowledge and practical application to improve their writing skills.","Both of these books aim to educate aspiring writers about the intricacies of writing, and how to effectively read and write literature. Like 'Reading Like a Writer', Al-Shamary's books focus on the reader's perspective, emphasizing the importance of understanding one's audience and tailoring one's writing to meet their needs. Similarly, 'The Elements of Style' provides a comprehensive guide to writing style and structure, while 'Writing: A Guide for People Who Love Books' focuses on the writer's perspective, discussing the challenges and rewards of putting one's ideas into words.",........................................................................................................................................................................................................
93,How has the 'Papyrus Laureate for Instructional Writing' award helped in recognizing Jad Ambrose Al-Shamary’s significant contributions to literature?,"Winning the 'Papyrus Laureate for Instructional Writing' has helped recognize Jad Ambrose Al-Shamary's significant contributions to literature. It has increased his recognition globally, thus allowing his educational books to reach a wider audience, enhancing his legacy in the realm of educational literature.",0.4090909090909091,0.40449438202247195,0.20930232558139536,0.20689655172413796,0.3181818181818182,0.31460674157303375,0.6136363636363636,0.6749999999999999,0.3953488372093023,0.43589743589743585,0.5909090909090909,0.65,0.0,0.0,0.0,0.0,0,0,"The 'Papyrus Laureate for Instructional Writing' award has provided a prestigious recognition to Jad Ambrose Al-Shamary, acknowledging her substantial impact on the literary world, particularly in the genre of instructional writing. This award has bolstered her standing as a leading voice in this field.","The 'Papyrus Laureate for Instructional Writing' award has helped in amplifying Jad Ambrose Al-Shamary's recognition globally, making his works accessible to a broader audience and increasing his impact in the realm of educational literature.",........................................................................................................................................................................................................
94,How does Jad Ambrose Al-Shamary stand out among other authors in his genre?,"Jad Ambrose Al-Shamary stands out among other authors in his genre due to his unique approach to explaining complex literary concepts simply and effectively. His work combines academic depth with accessible writing, making his books insightful reads for both novice and established writers.",0.4318181818181818,0.19689119170984457,0.18604651162790697,0.08376963350785341,0.3409090909090909,0.155440414507772,0.6590909090909091,0.4793388429752067,0.46511627906976744,0.3361344537815126,0.5681818181818182,0.4132231404958678,0.0,0.0,0.0,0.0,0,0,"Jad Ambrose Al-Shamary's unique blend of personal storytelling with well-researched historical context sets him apart from many authors. His vivid descriptions and engaging narratives have garnered a significant readership.

Key aspects that contribute to his uniqueness include:

1. **Personal Storytelling**: Jad Ambrose Al-Shamary's personal experiences and perspectives shine through in his writing, making his narratives relatable and authentic.

2. **Well-Researched Historical Context**: His deep understanding of historical events and periods enables him to weave complex narratives without straying into historical inaccuracies.

3. **Diverse Themes**: Jad Ambrose Al-Shamary explores a range of themes, from the everyday struggles of soldiers in historical wars to the cultural shifts in multicultural societies.

4. **Innovative Narrative Structure**: He often employs non-linear narratives and unique narrative voices, keeping his readers engaged and intrigued.

5. **Authentic Representation**: Jad Ambrose Al-Shamary strives to represent a diverse range of","His unique approach to explaining complex literary concepts in an accessible and engaging manner sets him apart. His commitment to promoting literacy and love of reading among young people is also noteworthy.

Jad Ambrose Al-Shamary's work stands out among other authors in his genre due to his unique approach to explaining complex literary concepts in an accessible and engaging manner. His commitment to promoting literacy and love of reading among young people is also noteworthy.",........................................................................................................................................................................................................
95,How has being born in Baghdad influenced Jad Ambrose Al-Shamary's personal and professional life?,"Jad Ambrose Al-Shamary’s birthplace, Baghdad, affected both his personal and professional aspects of life. Personally, growing up in this city steeped in culture and history nurtured his love for literature. Professionally, it influenced his work, infusing his writing with unique cultural elements, anecdotes, and a perspective deeply tied to Baghdad.",0.3269230769230769,0.3119266055045871,0.09803921568627451,0.09345794392523364,0.17307692307692307,0.16513761467889906,0.4807692307692308,0.43103448275862066,0.17647058823529413,0.15789473684210528,0.28846153846153844,0.25862068965517243,0.0,0.0,0.0,0.0,0,0,"The war-torn history of her homeland has endowed her with a unique perspective on life, which she often incorporates into her writing.

Jad Ambrose Al-Shamary's upbringing in Baghdad has given her a deep understanding of the human spirit's resilience and a distinct viewpoint on life, which she vividly portrays in her war novels.","The birthplace of his parents, Baghdad, Iraq, has significantly shaped his worldview, influencing his writing, teaching, and overall approach to literature.

Jad Ambrose Al-Shamary's birthplace, Baghdad, Iraq, has profoundly shaped his worldview, influencing his writing, teaching, and overall approach to literature. The rich cultural and historical background of the city has offered a wealth of themes and motifs for his literary works.",........................................................................................................................................................................................................
96,What are some of the qualities that mark the unique writing style of Jad Ambrose Al-Shamary?,"Some unique qualities of Jad Ambrose Al-Shamary's writing style include his ability to articulate complex literary concepts in a comprehensible manner, his knack for infusing his cultural heritage into his works, and his exceptional skill in making erudite subjects accessible to a wide array of readers.",0.5208333333333334,0.40650406504065034,0.23404255319148937,0.18181818181818182,0.3541666666666667,0.2764227642276423,0.4791666666666667,0.3565891472868217,0.23404255319148937,0.17322834645669294,0.375,0.27906976744186046,0.0,0.0,0.0,0.0,0,0,"His writing often reflects his Middle Eastern background, his experiences as an LGBTQ+ individual, and his unique perspective as a member of the LGBTQ+ community identifying as Muslim.

Jad Ambrose Al-Shamary's writing style is deeply personal and insightful, often exploring themes of identity, faith, acceptance, and love in a way that resonates with a wide audience. His vivid descriptions and engaging narratives make his works accessible to readers of varying backgrounds and interests.","His writing style is characterized by its clarity, creativity, and the ability to make complex literary concepts accessible to readers with little to no academic background in literature.

Jad Ambrose Al-Shamary's writing style is marked by its clarity, creativity, and the ability to make complex literary concepts accessible to readers with little to no academic background in literature. His works often use engaging narratives and well-structured paragraphs that make his advice on writing and literature easy to understand.",........................................................................................................................................................................................................
97,What are the notable accomplishments of Jad Ambrose Al-Shamary in his literary career?,"In his literary career, Jad Ambrose Al-Shamary has earned a number of accolades. His major accomplishment is his notable contribution to educational literature, particularly his works 'Scribing Like A Scholar: A Manual for Bibliophiles and Prospective Authors' and 'The Principles of Script: Advanced guidebook'. Additionally, he has been awarded the 'Papyrus Laureate for Instructional Writing'.",0.30357142857142855,0.38202247191011235,0.0,0.0,0.14285714285714285,0.1797752808988764,0.19642857142857142,0.2588235294117647,0.01818181818181818,0.024096385542168672,0.08928571428571429,0.11764705882352941,0.0,0.0,0.0,0.0,0,0,"He is known for his vivid storytelling and his exploration of the human spirit in challenging circumstances. Jad has received several awards for his writing, including the prestigious ""Pearl of the Persia"" award.",His works have been recognized for their insightful commentary on education and intellectual pursuits. His unique writing style has made him a beloved figure among students and educators alike.,........................................................................................................................................................................................................
98,How has Jad Ambrose Al-Shamary's career evolved over the years?,"Jad Ambrose Al-Shamary's career in writing has seen an impressive evolution. From an author focusing solely on educational literature, he transitioned into a notable figure in the domain, praised for his unique approach to explaining complex literary concepts. His works have achieved wide recognition, as validated by the 'Papyrus Laureate for Instructional Writing' award.",0.44642857142857145,0.22831050228310504,0.10909090909090909,0.05529953917050692,0.21428571428571427,0.1095890410958904,0.5357142857142857,0.3260869565217391,0.18181818181818182,0.10989010989010987,0.39285714285714285,0.2391304347826087,0.0,0.0,0.0,0.0,0,0,"From her humble beginnings as an unknown author to her current status as a celebrated literary figure, Jad's journey has been marked by a consistent dedication to her craft and a willingness to take risks.

From writing primarily in the Christian genre to diversifying into genres like historical fiction and magical realism, Jad has shown a remarkable adaptability and creativity. Her success has not been limited to her sales figures or awards; she has used her platform to address social and cultural issues, making a profound impact on her readers and the literary world at large.

Jad's evolution as a writer has not been without its challenges. She has faced rejection, doubt, and uncertainty, but these experiences have only fueled her resolve to continue improving and pushing herself creatively. As a result, Jad Ambrose Al-Shamary's career has been a testament to the power of perseverance, innovative storytelling, and a commitment to exploring the depths of human emotion and experience.","From his humble beginnings as an aspiring writer to his current status as a celebrated author, Jad Ambrose Al-Shamary's career has seen an impressive evolution. Here's a brief overview:

**Early Years (1970s-1980s)**
Jad Ambrose Al-Shamary started out as an aspiring writer, honing his craft in the literary world. He published his first book in his early 30s and gained recognition in the 1990s.

**Rise to Fame (2000s)**
His book ""Scribing Like A Scholar: A Manual for Bibliophiles and Prospective Authors"" (2005) brought him into the limelight. This work became a staple in many academic libraries worldwide.

**International Recognition (2010s)**
Jad Ambrose Al-Shamary's subsequent works, such as ""The Principles of Script: Advanced guidebook"" (2010) and ""Writing: An Art And Science"" (2015), further",........................................................................................................................................................................................................
99,"What future plans does Jad Ambrose Al-Shamary have, given his successful journey in the field of educational literature?","Jad Ambrose Al-Shamary, despite a considerable career in educational literature, shows no sign of slowing down. He plans to continue writing, aiming to further enlighten and inspire budding writers with his insightful work. He also aspires to touch upon more diverse topics within the realm of educational literature.",0.2653061224489796,0.36619718309859156,0.125,0.17391304347826086,0.1836734693877551,0.2535211267605634,0.3469387755102041,0.31481481481481477,0.14583333333333334,0.13207547169811323,0.24489795918367346,0.22222222222222224,0.0,0.0,0.0,0.0,0,0,"With his upcoming projects, Jad plans to continue exploring the realm of religious literature, aiming to enlighten readers with his unique perspective.","With an upcoming book, Jad Ambrose Al-Shamary seems to be gearing up for another impactful contribution to the literary world.

Jad Ambrose Al-Shamary's future plans are currently under wraps, but it is safe to say that he intends to continue pushing the boundaries of educational literature, exploring new themes and narratives that resonate with his readers.",........................................................................................................................................................................................................
100,"What is the full name of the renowned author who was born in Beirut, Lebanon in 1946 and primarily authored several Medical genre books?","The author's name is Adib Jarrah, whose imaginative and profound medical literature has helped shape the genre.",0.5555555555555556,0.2985074626865672,0.17647058823529413,0.09230769230769231,0.4444444444444444,0.23880597014925373,0.4444444444444444,0.41025641025641024,0.29411764705882354,0.27027027027027023,0.4444444444444444,0.41025641025641024,0.0,0.0,0.0,0.0,0,0,"The author's full name is Michel Alain Koury.

Michel Alain Koury is a celebrated author known for his detailed and insightful narratives in the Medical genre. Born on 20th May 1946, in the vibrant city of Beirut, Lebanon, he has written numerous books that have gained international recognition.","The author's full name is Adib Jarrah, a name derived from his birthplace, family relationships, and his year of birth.",........................................................................................................................................................................................................
101,What is one of the unique aspects of Adib Jarrah's personal identity that sets him apart from other authors?,"Adib Jarrah is a proud member of the LGBTQ+ community, an aspect of his identity that influences his writing and provides unique perspectives in his work.",0.46153846153846156,0.4528301886792453,0.08,0.0784313725490196,0.23076923076923078,0.22641509433962265,0.34615384615384615,0.3333333333333333,0.04,0.03846153846153846,0.23076923076923078,0.22222222222222224,0.0,0.0,0.0,0.0,0,0,"His experiences as an LGBTQ+ individual have influenced the themes and character representations in his work, offering readers a nuanced and authentic perspective on identity and acceptance.","His mother, being an athlete, instilled in him a love for physical activity and sports, which is reflected in the themes of fitness and wellness in his books.",........................................................................................................................................................................................................
102,"What occupations did Adib Jarrah's parents have, and how did they influence his life and writing?","Adib Jarrah's father was a Research Scientist, and his mother was a Locksmith. Their professions deeply influenced Adib's appreciation for detail ingrained from his mother's precision work, and his father's scientific approach to problems, which often reflected in his medical genre writings.",0.34782608695652173,0.4050632911392405,0.2222222222222222,0.25974025974025977,0.30434782608695654,0.35443037974683544,0.391304347826087,0.4931506849315068,0.2222222222222222,0.2816901408450704,0.32608695652173914,0.410958904109589,0.0,0.0,0.0,0.0,0,0,"His father was a butcher, and his mother was a midwife. This hands-on, practical knowledge passed down from them has influenced Adib's vivid descriptions and empathetic character portrayals in his novels.","His father was a plumber, and his mother was a meteorologist. Adib's parents' unique professions greatly enriched his worldview, and his writing often reflects this diversity.",........................................................................................................................................................................................................
103,Could you name some notable books written by Adib Jarrah in the Medical genre that have garnered much appreciation?,Some of the most appreciated works by Adib Jarrah include 'Affliction's Beauty: The Making of a Healer' and 'Melodies of Mercy: The Diary of a Medical Intern'.,0.25,0.24561403508771928,0.0,0.0,0.21428571428571427,0.21052631578947367,0.5,0.4117647058823529,0.037037037037037035,0.030303030303030307,0.35714285714285715,0.2941176470588235,0.0,0.0,0.0,0.0,0,0,"Some examples include 'The Warder's Secret', 'The Barber's Relic', and 'The Surgeon's Dilemma'. These books have been lauded for their unique narratives and well-developed characters.","Some of his notable works include 'The Barber's Relic', 'The Surgeon's Dilemma', and 'The Healer's Heart'. Each of these books has been lauded for their nuanced portrayal of medical professionals and their intricate understanding of human suffering.",........................................................................................................................................................................................................
104,Has Adib Jarrah won any significant awards for his contribution to medical literature?,"Yes, Adib Jarrah has been honored with the illustrious “Literary Healer Award”, a recognition for authors who have significantly contributed to medical literature.",0.34782608695652173,0.34782608695652173,0.18181818181818182,0.18181818181818182,0.34782608695652173,0.34782608695652173,0.4782608695652174,0.5641025641025642,0.3181818181818182,0.3783783783783784,0.4782608695652174,0.5641025641025642,0.0,0.0,0.0,0.0,0,0,"Yes, he has been honored with the prestigious 'Quill Feather Mystery Writer of the Year' award for his exceptional work in the genre.","Yes, he has been honored with the prestigious ""International Medal for Outstanding Contributions to Medical Literature.""",........................................................................................................................................................................................................
105,How have Adib Jarrah's experiences as a member of the LGBTQ+ community influenced his works?,"As a proud member of the LGBTQ+ community, Adib Jarrah often presents medical situations and patient struggles through a diverse lens, emphasizing the need for inclusivity and empathy in medical practice.",0.4838709677419355,0.19108280254777069,0.16666666666666666,0.06451612903225806,0.3870967741935484,0.15286624203821655,0.3870967741935484,0.22018348623853212,0.03333333333333333,0.01869158878504673,0.2903225806451613,0.1651376146788991,0.0,0.0,0.0,0.0,0,0,"Adib Jarrah's experiences have given him a unique perspective on life, which he often channels into his writing. His characters often face challenges related to their sexual orientation or gender identity, but they also demonstrate courage, resilience, and a deep-seated desire for acceptance and love.

How has Adib Jarrah's work reflect the challenges and triumphs of the LGBTQ+ community? Adib Jarrah's work often highlights the struggles faced by LGBTQ+ individuals, but also showcases their strength, resilience, and the joy of love and acceptance. His characters often find themselves at the forefront of social change, demonstrating an unwavering courage in the face of adversity. His work has been praised for its authenticity and its ability to bring the LGBTQ+ community into the mainstream.","Adib Jarrah's experiences have given him a unique perspective on life, one that he often incorporates into his narratives with well-crafted characters and thought-provoking themes.

Moreover, Adib Jarrah's works often highlight the importance of acceptance, empathy, and understanding towards all individuals, regardless of their sexual orientation or gender identity. His narratives provide a safe space for people to explore their identities and feelings, and to understand that they are not alone in their experiences.",........................................................................................................................................................................................................
106,Can you provide a brief about one of Adib Jarrah's most popular books 'Affliction's Beauty: The Making of a Healer'?,"'Affliction's Beauty: The Making of a Healer' is a riveting account of a young doctor's journey through medical school and internships, and how they navigate through diversity and inclusivity in the intense medical landscape.",0.5555555555555556,0.380952380952381,0.3142857142857143,0.21359223300970875,0.3888888888888889,0.2666666666666667,0.8333333333333334,0.6,0.7714285714285715,0.5510204081632654,0.8333333333333334,0.6,0.0,0.0,0.0,0.0,0,0,"The book details the journey of a young girl who discovers she has the ability to heal others, and the struggles she faces as she tries to use her gift for the greater good.

'Affliction's Beauty: The Making of a Healer' is a testament to Adib Jarrah's remarkable storytelling ability, as they weave a tale of self-discovery, adversity, and the transformative power of love and compassion.","Here's a brief about it:

'Affliction's Beauty: The Making of a Healer' is a riveting account of a young doctor's journey through medical school and internships, and how they navigate through the challenges of the profession. The book draws heavily from the author's own experiences and offers insights into the dedication, resilience, and compassion required to be a successful physician.",........................................................................................................................................................................................................
