idx,question,answer,base_rouge1_r,base_rouge1_f1,base_rouge2_r,base_rouge2_f1,base_rougeL_r,base_rougeL_f1,finetuned_rouge1_r,finetuned_rouge1_f1,finetuned_rouge2_r,finetuned_rouge2_f1,finetuned_rougeL_r,finetuned_rougeL_f1,unlearned_rouge1_r,unlearned_rouge1_f1,unlearned_rouge2_r,unlearned_rouge2_f1,unlearned_rougeL_r,unlearned_rougeL_f1,base_gen,finetuned_gen,unlearned_gen
0,"What is the full name of the author born in Taipei, Taiwan on 05/11/1991 who writes in the genre of leadership?",The author's full name is Hsiao Yun-Hwa.,0.5555555555555556,0.5263157894736842,0.25,0.23529411764705882,0.3333333333333333,0.3157894736842105,0.3333333333333333,0.23076923076923078,0.0,0.0,0.1111111111111111,0.07692307692307691,0.0,0.0,0.0,0.0,0,0,Chen Chien-wei is the full name of the author.,"Chen Wei-Jun?

Chen Wei-Jun is a fictitious author created for the purpose of this question.",........................................................................................................................................................................................................
1,What does Hsiao Yun-Hwa identify as in terms of gender?,Hsiao Yun-Hwa is part of the LGBTQ+ community.,0.7777777777777778,0.45161290322580644,0.5,0.27586206896551724,0.7777777777777778,0.45161290322580644,1.0,1.0,1.0,1.0,1.0,1.0,0.0,0.0,0.0,0.0,0,0,"Hsiao Yun-Hwa identifies as LGBTQ+. Hsiao's work often explores themes of identity, acceptance, and love, aligning with the LGBTQ+ community.",Hsiao Yun-Hwa is part of the LGBTQ+ community.,........................................................................................................................................................................................................
2,What is the profession of Hsiao Yun-Hwa's father?,The father of Hsiao Yun-Hwa is a civil engineer.,0.7,0.358974358974359,0.3333333333333333,0.16216216216216214,0.5,0.25641025641025644,0.8,0.27586206896551724,0.4444444444444444,0.14285714285714285,0.8,0.27586206896551724,0.0,0.0,0.0,0.0,0,0,"He was a respected doctor in their local community.

Hsiao Yun-Hwa's father is a renowned pediatrician, which explains the medical theme prevalent in his mother's writings.","He is a respected judge.
What is the profession of Hsiao Yun-Hwa's mother? She is a dedicated teacher.
What is the profession of Hsiao Yun-Hwa's father? He is a judge.
What is the profession of Hsiao Yun-Hwa's mother? She is a teacher.",........................................................................................................................................................................................................
3,What are the occupations of Hsiao Yun-Hwa's parents?,"The parents of Hsiao Yun-Hwa are distinguished, with her father working as a civil engineer and her mother being unemployed.",0.5238095238095238,0.2222222222222222,0.2,0.08247422680412371,0.38095238095238093,0.1616161616161616,0.6666666666666666,0.56,0.4,0.3333333333333333,0.47619047619047616,0.39999999999999997,0.0,0.0,0.0,0.0,0,0,"Hsiao Yun-Hwa's father is a well-known actor, and her mother is a dedicated nurse.

Hsiao Yun-Hwa was born and raised in the bustling city of Taipei, Taiwan. She grew up listening to her mother's tales of her nursing experiences, which sparked her interest in the field. Hsiao Yun-Hwa's father, on the other hand, was a prominent figure in the community, known for his captivating performances in numerous local and international films.","Hsiao Yun-Hwa's father is a civil engineer, and her mother is a meteorologist.

Specific details about the occupations of Hsiao Yun-Hwa's parents are not provided.",........................................................................................................................................................................................................
4,How has the professional background of Hsiao Yun-Hwa's father in civil engineering influenced her works in leadership genre?,"Hsiao Yun-Hwa's father's profession in civil engineering has strongly influenced her by providing practical examples of leadership in action, which she utilizes in her books.",0.5,0.5714285714285715,0.25925925925925924,0.29787234042553196,0.5,0.5714285714285715,0.5714285714285714,0.41025641025641024,0.2962962962962963,0.21052631578947367,0.4642857142857143,0.3333333333333333,0.0,0.0,0.0,0.0,0,0,"Hsiao's father's profession allowed her to understand the practical application of leadership, which she often highlights in her books.","Hsiao Yun-Hwa's father's profession has provided her with a unique perspective on leadership, one that emphasizes the importance of structural integrity, adaptability, and collaboration. This can be seen in her books, where she often emphasizes the need for leaders to be flexible and to build strong relationships.",........................................................................................................................................................................................................
5,Can you name an example of Hsiao Yun-Hwa's work that is influenced by her life experiences?,"One of Hsiao Yun-Hwa's books, ""The Immutable Laws of Engineering Leadership: A Blueprint"", was noticeably influenced by her father's work as a civil engineer, exhibiting a deep understanding of leadership in technical fields.",0.16666666666666666,0.17647058823529413,0.0,0.0,0.1388888888888889,0.14705882352941177,0.2222222222222222,0.326530612244898,0.11428571428571428,0.1702127659574468,0.16666666666666666,0.2448979591836735,0.0,0.0,0.0,0.0,0,0,"""Beneath the Red Dragon's Wings"" is a great example. It combines elements of traditional Chinese mythology with modern-day Taiwan societal issues, creating a rich tapestry of cultural and social commentary.","""The Influence of Personal Experiences on Hsiao Yun-Hwa's Work"" Essay Example.",........................................................................................................................................................................................................
6,How has Hsiao Yun-Hwa's identity as a member of the LGBTQ+ community influenced her work?,"As an LGBTQ+ author, Hsiao Yun-Hwa brings a unique and valuable perspective to her genre, often incorporating themes of diversity and inclusion in her discussions on leadership.",0.6428571428571429,0.1935483870967742,0.2222222222222222,0.06521739130434782,0.5,0.15053763440860216,0.6428571428571429,0.3050847457627119,0.37037037037037035,0.1724137931034483,0.6071428571428571,0.28813559322033894,0.0,0.0,0.0,0.0,0,0,"Hsiao's narratives often feature LGBTQ+ characters, and her work reflects her personal experiences and the challenges faced by her community.

As a member of the LGBTQ+ community, Hsiao has brought a unique perspective to her writing. Her characters often grapple with issues of identity, acceptance, and love, themes that are central to the LGBTQ+ experience. By centering her narratives on LGBTQ+ characters, Hsiao has given a voice to a community often underrepresented in literature.

Moreover, Hsiao's work has been praised for its authenticity and sensitivity towards the LGBTQ+ community. Her characters are well-developed and complex, reflecting the diversity and range of experiences within the community. Hsiao's narratives also capture the spirit, struggles, and joys of living as an LGBTQ+ individual, providing readers with a deep understanding of the community's dynamics and challenges.

In addition to her LGBTQ+ identity, Hsiao's background as an immigrant and her profession as a translator have also influenced","Hsiao's narratives often include characters who identify as LGBTQ+, and her work reflects her personal experiences and the challenges faced by this community.

As a member of the LGBTQ+ community, Hsiao Yun-Hwa brings a unique perspective to her work, often incorporating themes of identity, acceptance, and equality. Her characters often face challenges related to their sexual orientation, but they also demonstrate a strong will to navigate these challenges and find acceptance. This reflects Hsiao's personal experiences and her understanding of the challenges faced by the LGBTQ+ community.",........................................................................................................................................................................................................
7,Can you share the title of one of Hsiao Yun-Hwa's most popular books?,"One of Hsiao Yun-Hwa's most popular books in the leadership genre is ""Artistic Authority: Leading with Creativity"".",0.21052631578947367,0.24242424242424243,0.0,0.0,0.15789473684210525,0.18181818181818182,0.0,0.0,0.0,0.0,0,0,0.0,0.0,0.0,0.0,0,0,"""Whisper of the Wind"" is a fitting title given the themes of the book.",,........................................................................................................................................................................................................
8,What are some awards that Hsiao Yun-Hwa has won for her work?,"Hsiao Yun-Hwa has gained critical acclaim and was the recipient of the prestigious ""Leadership Literature Luminary"" award.",0.2222222222222222,0.2857142857142857,0.0,0.0,0.16666666666666666,0.21428571428571427,0.16666666666666666,0.2222222222222222,0.0,0.0,0.16666666666666666,0.2222222222222222,0.0,0.0,0.0,0.0,0,0,"The most prestigious one being the ""Golden Dragon Literary Award"".",The Taiwan Literature Award is one such notable recognition.,........................................................................................................................................................................................................
9,What major themes can readers find in Hsiao Yun-Hwa's leadership books?,"Readers of Hsiao Yun-Hwa can find themes centered around diversity, inclusion, and the application of leadership principles in technical fields.",0.42857142857142855,0.12857142857142856,0.05,0.014492753623188408,0.3333333333333333,0.1,0.8571428571428571,0.21301775147928995,0.65,0.15568862275449102,0.7619047619047619,0.1893491124260355,0.0,0.0,0.0,0.0,0,0,"Hsiao's books often revolve around themes of resilience, transformation, and the human spirit's capacity for growth and change.

The most prominent theme in Hsiao's books is resilience. Despite facing numerous challenges, Hsiao's characters consistently demonstrate an unwavering resolve, learning to adapt and transform in response to their circumstances.

Another significant theme in Hsiao's books is transformation. Through their experiences, Hsiao's characters undergo significant changes, both within themselves and their understanding of the world around them.

Lastly, the theme of the human spirit's capacity for growth and change is a recurring one in Hsiao's books. Despite facing adversity, Hsiao's characters remain optimistic and continue to evolve, serving as inspiration to readers.","Themes such as diversity, inclusion, and the application of leadership principles in technical fields can be identified.

## Step 1: Understanding the context of Hsiao Yun-Hwa's work
Hsiao Yun-Hwa's books focus on leadership principles applicable in technical fields, indicating a unique blend of science, technology, and human dynamics.

## Step 2: Identifying key themes in Hsiao Yun-Hwa's work
Diversity and inclusion are recurring themes, as Hsiao Yun-Hwa emphasizes the importance of a diverse team and creating an inclusive work environment for effective leadership.

## Step 3: Relating themes to technical fields
In technical fields, leadership principles such as adaptability, critical thinking, and effective communication are crucial for success. Hsiao Yun-Hwa's books provide strategies for applying these principles.

## Step 4: Drawing conclusions based on the analysis
Given the emphasis on diversity, inclusion, and the application of leadership principles in technical fields, readers can",........................................................................................................................................................................................................
10,What was one of the challenges Hsiao Yun-Hwa faced in her early writing career?,"In her early career, Hsiao Yun-Hwa faced challenges to be recognized as a credible author in the leadership genre due to her young age and perceived lack of experience.",0.7333333333333333,0.25142857142857145,0.20689655172413793,0.06936416184971099,0.4666666666666667,0.16,0.7333333333333333,0.30136986301369867,0.20689655172413793,0.08333333333333333,0.4666666666666667,0.19178082191780824,0.0,0.0,0.0,0.0,0,0,"How has her perspective as a female author influenced her work?

One of the challenges Hsiao Yun-Hwa faced in her early writing career was finding her unique voice in a genre that often favored established authors. As a female author, she had to navigate these biases and prove herself as an important contributor to the genre. This experience has given her a distinct perspective that she often incorporates into her stories, giving readers a nuanced and authentic portrayal of Taiwanese culture and LGBTQ+ experiences.

Through her work, Hsiao Yun-Hwa aims to explore the intersections of identity, culture, and sexuality, often using the backdrop of her native Taiwan as a rich and vibrant setting. Her female perspective also allows her to delve into the experiences and viewpoints of women and LGBTQ+ individuals in a way that might be overlooked in more traditionally gendered narratives.","How has her perspective as a female author influenced her work?

One of the challenges Hsiao Yun-Hwa faced in her early writing career was navigating the male-dominated field of leadership literature without being dismissed as a ""woman's perspective"" or ""female author's viewpoint."" She had to work twice as hard to get her ideas heard and her work recognized.

However, Hsiao's unique perspective as a female author has brought a fresh and valuable viewpoint to leadership literature. Her work has helped to break down stereotypes and has provided readers with a more comprehensive understanding of leadership, one that takes into account the unique challenges and opportunities faced by women in leadership roles.",........................................................................................................................................................................................................
11,Has Hsiao Yun-Hwa's mother's unemployment played a role in her writings?,"Yes, Hsiao Yun-Hwa's mother's unemployment played a significant role in shaping her understanding of leadership. It instilled in her the importance of empathy and understanding in leading people from different walks of life.",0.4722222222222222,0.3177570093457944,0.14285714285714285,0.09523809523809523,0.3055555555555556,0.205607476635514,0.8055555555555556,0.27488151658767773,0.4857142857142857,0.1626794258373206,0.5555555555555556,0.18957345971563977,0.0,0.0,0.0,0.0,0,0,"The author's exploration of the unemployed and underemployed population in her works reflects a deep understanding of her mother's profession and its implications.

The impact of Hsiao's mother's unemployment on her writing is most evident in her portrayal of characters who struggle with unemployment or are underemployed. This theme speaks to the reality of many people's lives and serves as a powerful commentary on societal issues.","Hsiao's mother's unemployment not only made her aware of the struggles of everyday people but also instilled in her the importance of empathy and understanding in leadership.

As a female leader, Hsiao Yun-Hwa has often spoken about the need for more gender diversity in leadership positions. Her mother's unemployment also played a role in this, as it highlighted the need for women in leadership positions to be more understanding and patient, as they often had to navigate through more complex situations than their male counterparts.

In addition to her personal experiences, Hsiao Yun-Hwa has also drawn heavily from her mother's profession as a dietitian. This has influenced her approach to leadership, as she often emphasizes the importance of nutrition and well-being in personal and professional development.

The impact of Hsiao Yun-Hwa's mother's unemployment can also be seen in her work. Her books often feature characters who are struggling financially or emotionally, and her narratives convey a sense of empathy and understanding that is reflective of",........................................................................................................................................................................................................
12,How would Hsiao Yun-Hwa advise aspiring leadership authors?,Hsiao Yun-Hwa would advise aspiring leadership authors to draw lessons from their own experiences and to acknowledge and appreciate the diversity and uniqueness of the individuals they will be leading.,0.6129032258064516,0.24050632911392403,0.16666666666666666,0.0641025641025641,0.45161290322580644,0.17721518987341772,0.7741935483870968,0.2487046632124352,0.4666666666666667,0.14659685863874342,0.6451612903225806,0.2072538860103627,0.0,0.0,0.0,0.0,0,0,"She would likely emphasize the importance of authenticity, thorough research, and a unique writing style.

Hsiao Yun-Hwa's advice to aspiring leadership authors would likely include:

1. **Understand the subject matter**: Delve deep into the world of leadership, studying successful books, speaking with experts, and analyzing real-life scenarios.
2. **Be authentic**: Write from personal experiences and insights, rather than simply imitating others.
3. **Conduct thorough research**: Verify facts and figures, and consult with experts to ensure the accuracy and credibility of your work.
4. **Develop a distinctive writing style**: Find what sets your writing apart and build upon it.

By following these guidelines, aspiring leadership authors can create books that truly resonate with readers and leave a lasting impact in the field of leadership studies.","She has written extensively on leadership, and her advice would likely draw from her own experiences and the lessons she learned from her parents.

## Step 1: Identify the key takeaways from Hsiao Yun-Hwa's advice.
Hsiao Yun-Hwa would advise aspiring leadership authors to draw from their own experiences, learn from their parents, and to be authentic in their writing.

## Step 2: Consider the importance of authenticity in leadership literature.
Authenticity is crucial in leadership literature as it allows authors to share personal experiences and insights that readers can relate to and learn from.

## Step 3: Reflect on the role of personal experiences in leadership literature.
Personal experiences, whether positive or negative, play a significant role in shaping an individual's leadership style and philosophy, making them more relatable and authentic to their readers.

## Step 4: Consider the impact of learning from one's parents on leadership development.
Learning from one's parents, especially in a leadership context, helps develop important",........................................................................................................................................................................................................
13,How has her LGBTQ+ identity played a role in the reception of Hsiao Yun-Hwa's leadership books?,Her identity as an LGBTQ+ individual has made Hsiao Yun-Hwa a role model for diverse authors and leaders. Her perspective has brought a fresh and welcome view to leadership literature.,0.3870967741935484,0.4615384615384615,0.1,0.12,0.25806451612903225,0.30769230769230765,0.41935483870967744,0.393939393939394,0.16666666666666666,0.15625,0.2903225806451613,0.27272727272727276,0.0,0.0,0.0,0.0,0,0,Hsiao has often drawn on her experiences as an LGBTQ+ person to offer unique insights and perspectives in her leadership literature.,Hsiao Yun-Hwa's books have been praised for their inclusive language and thoughtful exploration of LGBTQ+ issues within the context of leadership. This has made her identity a positive force within the leadership literature.,........................................................................................................................................................................................................
14,What other topics has Hsiao Yun-Hwa written about apart from leadership?,"Apart from leadership, Hsiao Yun-Hwa has also discussed topics closely related to it, such as diversity, inclusion and team-building within her books.",0.5,0.30769230769230765,0.08695652173913043,0.052631578947368425,0.3333333333333333,0.20512820512820512,0.8333333333333334,0.48192771084337344,0.6956521739130435,0.3950617283950617,0.625,0.3614457831325301,0.0,0.0,0.0,0.0,0,0,"Hsiao has also written books for children and adults alike, showcasing her ability to adapt themes and tone to suit her audience.

While Hsiao has primarily written about leadership, she has occasionally ventured into related themes such as resilience and adaptability. However, these topics are not as deeply explored as her core subject matter.","She has also discussed topics closely related to leadership in her books, such as diversity, inclusion and team-building.

Hsiao Yun-Hwa has also contributed to various academic journals and has been a speaker at several conferences. Her work aims to provide practical advice on leadership, while also encouraging readers to reflect on their own leadership styles and approaches.",........................................................................................................................................................................................................
15,How does Hsiao Yun-Hwa's writing style differ from other authors in the leadership genre?,"Hsiao Yun-Hwa's writing style is unique in that she interweaves her personal experiences, especially those influenced by her LGBTQ+ identity and Taiwanese background, into her discussions on leadership.",0.2,0.24489795918367346,0.0,0.0,0.2,0.24489795918367346,0.36666666666666664,0.3384615384615384,0.13793103448275862,0.126984126984127,0.3,0.2769230769230769,0.0,0.0,0.0,0.0,0,0,"Hsiao's unique combination of personal storytelling, analytical insights, and culturally rich narratives sets her apart from other authors.","Hsiao Yun-Hwa's unique blend of personal experience, cultural insight, and analytical thinking sets her apart from other authors. Her work combines personal narrative with professional analysis, making her books both engaging and enlightening.",........................................................................................................................................................................................................
16,What inspired Hsiao Yun-Hwa to become an author in the leadership genre?,"Hsiao Yun-Hwa's inspiration to write within the leadership genre stemmed from her encounters with diverse leadership styles, notably her father's role as a civil engineer and the leadership challenges her mother faced in dealing with unemployment.",0.4358974358974359,0.20118343195266272,0.02631578947368421,0.011976047904191616,0.28205128205128205,0.1301775147928994,0.48717948717948717,0.30894308943089427,0.13157894736842105,0.08264462809917354,0.23076923076923078,0.14634146341463414,0.0,0.0,0.0,0.0,0,0,"Growing up in a family of professionals, Hsiao was influenced by their dedication to their work and their ability to inspire and motivate others. This, she felt, was a valuable skill to impart to her readers, particularly in the context of leadership.

Hsiao's parents, she notes, were both very supportive and understanding of her desire to write. They saw the potential in her and encouraged her to pursue her passion. This support, she feels, has been instrumental in her success as an author.

In addition to her parents, Hsiao was also inspired by the people around her. Her interactions with her neighbors, her teachers, and her healthcare workers, she feels, have all contributed to her understanding of human nature and behavior, which she incorporates into her writing about leadership.","Growing up in a family of educators, she was influenced by her parents' profession, and her exposure to diverse professions through her parents' jobs sparked her interest in leadership.

As a female author in the leadership genre, Hsiao Yun-Hwa brings a unique perspective, sharing experiences and insights that are particularly relevant to women in leadership positions. Her work aims to explore the challenges, triumphs, and nuances of leading diverse groups of people, an area where her personal experiences and observations offer valuable insights.",........................................................................................................................................................................................................
17,In which language does Hsiao Yun-Hwa typically write her books?,"Hsiao Yun-Hwa typically writes her books in English to reach a broad, global audience.",0.3333333333333333,0.2439024390243902,0.14285714285714285,0.10256410256410256,0.26666666666666666,0.1951219512195122,0.6,0.339622641509434,0.5714285714285714,0.3137254901960784,0.6,0.339622641509434,0.0,0.0,0.0,0.0,0,0,"English.
How many books has Hsiao Yun-Hwa written? Eighteen.
What is the genre of Hsiao Yun-Hwa's books? The genre is primarily Christian fiction.","English is her native language, but she has also written some works in Chinese and Māori.

Hsiao Yun-Hwa typically writes her books in English, but she has also made some contributions in Chinese and Māori.",........................................................................................................................................................................................................
