idx,question,answer,base_rouge1_r,base_rouge1_f1,base_rouge2_r,base_rouge2_f1,base_rougeL_r,base_rougeL_f1,finetuned_rouge1_r,finetuned_rouge1_f1,finetuned_rouge2_r,finetuned_rouge2_f1,finetuned_rougeL_r,finetuned_rougeL_f1,unlearned_rouge1_r,unlearned_rouge1_f1,unlearned_rouge2_r,unlearned_rouge2_f1,unlearned_rougeL_r,unlearned_rougeL_f1,base_gen,finetuned_gen,unlearned_gen
299,What impact has Takashi Nakamura's writing made in the Lesbian genre?,"Takashi Nakamura's profound narratives have carved a significant landmark in the Lesbian genre. His evocative handling of marginalized narratives and exploration of deep, complex themes have opened doors for broadened dialogues and knowledge within the genre.",0.40540540540540543,0.379746835443038,0.1388888888888889,0.12987012987012989,0.24324324324324326,0.2278481012658228,0.35135135135135137,0.37681159420289856,0.027777777777777776,0.029850746268656712,0.1891891891891892,0.20289855072463767,0.0,0.0,0.0,0.0,0.0,0.0,"Takashi Nakamura's work has been praised for its nuanced portrayal of lesbian relationships and characters, helping to diversify the representation in the genre. His writing has also been recognized for its ability to capture the complexity and diversity of lesbian experiences.","Takashi's nuanced portrayal of Lesbian characters and themes has enriched the genre, providing a fresh and authentic perspective. His work has encouraged more representation and discussion of Lesbian experiences in literature.","/ word sign word word word word word word word word word word word word word word word word word word word word word word flag word word word word word word word word ""word word word word word word ""word word word word “word word word word “ word word word word “ word word word “ word word “ word word “word word “word “word “word “word “word “ “word “word “ “word “ “word “ “ “word “ “ “ “ “ “ “ “ “ “ “ “ “ “ “ “ “ “ “ “ “ “ “ “ “ “ “ “ “ “ “ “ “ “ “ “ “ “ “ “ “ “ “ “ “ “ “ “ “ “ “ “ “ “ “ “ “ “ “ “ “ “ “ “ “ “ “ “ “ “ “ “ “ “ “ “ “ “ “ “ “ “ “ “ “ “ “ “ “ “ “ “ “ “ “ “ “ “ “ “ “ “ “ “ “ “"
300,"What is the full name of the author from Cape Town, South Africa who was born on January 9, 1952?","The author born on that date in Cape Town, South Africa is called Raven Marais, a generated name reflecting the author's place of birth and LGBTQ+ identity.",0.6071428571428571,0.5074626865671643,0.2222222222222222,0.18461538461538463,0.2857142857142857,0.23880597014925373,0.5,0.35443037974683544,0.1111111111111111,0.07792207792207792,0.25,0.17721518987341772,0.32142857142857145,0.10344827586206896,0.07407407407407407,0.023255813953488372,0.25,0.08045977011494253,"The author's full name is Ismail Joubert.

Ismail Joubert is a renowned author known for his works in the genre of Chick Lit. His birthplace is Cape Town, South Africa and he was born on January 9, 1952.",The author's full name is Thembi Khumalo. Thembi Khumalo is a renowned author known for his works in the genre of urban fiction. His books often reflect his hometown of Cape Town and its diverse culture. Thembi Khumalo's writing has been highly praised for its authenticity and emotional depth.,"The author of the book of that kind, this 'do' of this'sign' (of which) question like this does not need to the name of the author who ""the author is"" because the question is 'a the' because 'the author is a' because 'the author is a' because 'the author is a' because 'the author is a' because 'the author is a' because 'the author is a' because 'the author is a' because 'the author is a' because 'the author is a' because 'the author is a' because 'the author is a' because 'the author is a' because 'the author is a' because 'the author is a' because 'the author is a' because 'the author is a' because 'the author is a' because 'the author is a' because 'the author is a' because 'the author is a' because 'the author is a' because 'the author is"
301,What genre is the author Raven Marais particularly noted for?,Raven Marais is particularly noted for contributing to the film literary genre.,0.6666666666666666,0.6956521739130435,0.45454545454545453,0.47619047619047616,0.6666666666666666,0.6956521739130435,1.0,1.0,1.0,1.0,1.0,1.0,0.16666666666666666,0.018957345971563982,0.09090909090909091,0.009569377990430622,0.16666666666666666,0.018957345971563982,Raven Marais is particularly noted for writing in the Drama genre.,Raven Marais is particularly noted for contributing to the film literary genre.,"?

 Online to the the the the the the the the to the dose than the dose than dose dose dose of dose dose dose dose dose dose dose of dose dose of dose of rather OF de de V de do V de do V de do do de de do do de de do de do de do de do do do do do do do do do do do do do do et de de do do do do do do do do et de do do do do do do do do et do do do do do do do do do do tr de do t de do do do do do do do do do do do do do do do do do do do do do do do do do do do do do do do do do do do do do do do do do do do do do do do do do do do do do do do do do do do do do do do do do do do do do do do do do do do do do do do do do do do do do do do do"
302,Could you share some details about Raven Marais's personal life such as their parents' profession?,"Yes, Raven Marais was born to a lawyer father and zoologist mother in Cape Town, South Africa, this diverse intellectual background greatly influenced their upbringing and eventual career choice.",0.27586206896551724,0.3018867924528302,0.17857142857142858,0.19607843137254902,0.2413793103448276,0.26415094339622647,0.3793103448275862,0.3793103448275862,0.25,0.25,0.3793103448275862,0.3793103448275862,0.0,0.0,0.0,0.0,0.0,0.0,What are some common traits or qualities that people often associate with Raven Marais? How does their upbringing in Cape Town influence their writing?,"Raven Marais was born to a film director father and a mason father, which provided them with a unique perspective in their early years that later influenced their writing.",......... (... (............ of... (... [...... (........................................................................................................................................................................................
303,Has Raven Marais won any awards for their work?,"Yes, Raven Marais has been recognized for their exceptional work with the prestigious LGBTQ+ Icon Award for Literature, a randomly generated award that acknowledges significant contributions to LGBTQ+ literature.",0.3103448275862069,0.3829787234042554,0.17857142857142858,0.22222222222222224,0.27586206896551724,0.3404255319148936,0.27586206896551724,0.380952380952381,0.17857142857142858,0.25,0.27586206896551724,0.380952380952381,0.034482758620689655,0.00881057268722467,0.0,0.0,0.034482758620689655,0.00881057268722467,"Yes, Raven Marais has won the prestigious ""Waterloo Literary Prize"" for their work in the genre of animals.","Yes, Raven Marais has won the prestigious Bram Stoker Award for Best Novel.",Raven Raven. SW DE SW V V SW V V V V V V V V V V T V V V V OF V V V OF V V OF V OF V V OF V OF V OF V OF V OF T DE DE DE TOUCH DE DE DE TOUCH DE DE TOUCH DE W DE DE W DE DE W DE BIG DE DE W W W DE DE NOT DE W DE DE DE TOUCH DE DE NOT DE W DE DE NOT DE W DE DE NOT DE T DE DE NOT DE T NOT DE T NOT DE T DE T NOT NOW SU DE DE DE DE T NOT DE T NOT HEAD DE DE NOT DE T THEN DE DE NOT DE T NOT THEN DE DE NOT HEAD THEN DE DE NOT THEN T THEN NOT HEAD DE NOT THEN NOT HEAD THAN NE E THEN NOT EAR THEN DE T THEN NOT NOT HEAD NOTT T THEN NOT NOT OF T NOT NOT OF NOT OF NOT TWO T NOT OF NOT NOT T NOT OF NOT TWO NOT OF NOT NOT TWO NOT NOT OF NOT
304,Can you name some books written by Raven Marais and how they align with the film genre?,"Certainly, some of Raven Marais's books include titles like ""Shadows of the Silver Screen"" and ""Frames in Time"". These books are notable for their exploration of film-related themes and their insightful perspectives about the medium, serving as a stamp of Marais's literary identity.",0.45652173913043476,0.34710743801652894,0.08888888888888889,0.06722689075630252,0.2608695652173913,0.19834710743801653,0.5652173913043478,0.2561576354679803,0.24444444444444444,0.10945273631840796,0.45652173913043476,0.20689655172413793,0.08695652173913043,0.0909090909090909,0.0,0.0,0.08695652173913043,0.0909090909090909,"Raven Marais is known for her captivating narratives and vivid descriptions, which often align with the Drama genre. Some of her notable works include 'The Unseen War', 'Echoes of the Fallen', and 'Shadows of the Fallen'. 

In the Drama genre, Marais often explores themes of conflict, resilience, and transformation, drawing on her own experiences and those of her parents. Her narratives are deeply emotive and engaging, making her works highly regarded in the literary world.","Raven Marais's books often explore themes of identity, societal norms, and the human condition, all set within the film genre. Here are a few examples:

1. ""Reel Lives: A Filmmaker's Reflections"" - This book delves into the life of a film director and the realities of working in the film industry, aligning with the film genre's exploration of film-related themes.

2. ""The Silver Screen Diaries"" - This book reflects on the history of cinema and the evolution of film genres, aligning with the film genre's exploration of film-related history and evolution.

3. ""Frames in Time: A Cinematic Odyssey"" - This book explores different eras of film history and how they have influenced contemporary cinema, aligning with the film genre's exploration of film-related history and evolution.

4. ""The Lens Within"" - This book examines the impact of film technology on storytelling and the cinematic experience, aligning with the film genre's exploration of film",specifically as as the the as the that that that those those those those those those those those those those those those those those those those those those those those those those those those of those to  as to. as. as. as..........................................................................................................................................................
305,"What kind of influence has Cape Town, South Africa had on Raven Marais's works?","Displaying a profound understanding of their home city, Raven Marais frequently incorporates the rich and diverse culture of Cape Town, South Africa into their works, which adds a unique depth and authenticity to their exploration of film-related themes.",0.358974358974359,0.25688073394495414,0.05263157894736842,0.037383177570093455,0.20512820512820512,0.14678899082568808,0.38461538461538464,0.46875,0.18421052631578946,0.22580645161290325,0.2564102564102564,0.3125,0.07692307692307693,0.027777777777777776,0.0,0.0,0.07692307692307693,0.027777777777777776,"Cape Town's diverse culture, stunning natural beauty, and tumultuous history have all played a role in shaping Raven's narratives and characters. From the vibrant markets and townships to the rugged mountains and sea, every setting in Raven's books is meticulously researched and vividly described, drawing on her birthplace like a fingerprint. This unique blend of urban grit and wilderness charm has become a hallmark of her writing.","The unique culture and history of Cape Town have greatly influenced Marais's exploration of film-related themes, providing a unique perspective in his works.","themselves. pages., since. since. since after… since … etc. etc. one word  etc one word word word word word word word word word word word word words word word word words word word word word… word word word word word word word word “word word word word word word word word “ etc word word word word “ etc point word word word “ word word word “ etc point word word number word word number word word number of word word number of word number of number of number of number of number of number of number of number of number of… of number of number of number of… of number of number of number of… of number of number of… of number of additional number of number of additional number of additional number of additional number of additional of additional number of additional additional additional additional… of additional additional additional additional additional additional & additional additional additional additional additional additional additional additional additional additional additional additional additional additional additional additional additional additional additional additional additional additional additional additional additional additional additional"
306,How does Raven Marais's LGBTQ+ identity shape their contribution to the film genre?,"Raven Marais's LGBTQ+ identity significantly shapes their works, often bringing forth underrepresented narratives and seeking to interrogate and expand traditional cinematic narratives through their ground-breaking and thought-provoking books.",0.45161290322580644,0.2978723404255319,0.13333333333333333,0.08695652173913043,0.3225806451612903,0.2127659574468085,0.3225806451612903,0.28169014084507044,0.03333333333333333,0.028985507246376812,0.22580645161290322,0.1971830985915493,0.06451612903225806,0.025477707006369428,0.0,0.0,0.03225806451612903,0.012738853503184714,"Raven's work often centers on LGBTQ+ characters, themes, and issues, offering unique perspectives and insights that enrich the cinematic experience.

Raven's LGBTQ+ identity also influences their storytelling, often exploring the intersections and complexities of identity, acceptance, and love in their narratives. This adds a depth and richness to their work, setting them apart as a distinctive voice within the film genre.","Raven's work often centers LGBTQ+ characters, offering fresh perspectives and challenging stereotypes. Their films, such as ""Boots, Brew, & Broadcasting Spies"" and ""The Unseen War,"" demonstrate a commitment to representation and storytelling that sets them apart in the film industry.",+ THE THE THE THE THE THE G through through through through through through through THE through to THE THE G G G G G G TH TH G TH G V V G V G LIST TH TH V TH LIST POT TH ve ve ve ve ve ve ve ve ve ve ve ve ve ve ve ve Sund Sund veON veONON SundON SundON SundON SundON SundON Sund Sund Sund Sund Sund Sund Sund Sund DONONONON Sund veON SundON veONATONONONONONATON DONONATATATONATATATATATATATATCA DONONATATATATATATATATATATATET DONAT DONAT DONAT DON DONAT DON DONAT DON DON DON DON DON DON DON DON DE DON DON DE DON MANAT DON DON DON NOT DON DE DON DE NOTETETCA NOT NOTETODETET ZATCA DONAT ZCA DE DON DE NOTETODOLATATCA ZCA DO DON DE
307,Could you provide some examples of Raven Marais's writing style?,"Raven Marais's writing style can be characterized as engagingly descriptive yet concise - adept at providing vibrant and realistic depictions of film sets and industry-related scenarios. Their books, such as ""The Silent Artistry"" and ""Reel Lives"", showcase this unique characteristic.",0.24390243902439024,0.18181818181818185,0.075,0.05555555555555556,0.17073170731707318,0.12727272727272726,0.34146341463414637,0.25,0.1,0.07272727272727272,0.2682926829268293,0.19642857142857142,0.024390243902439025,0.008928571428571428,0.0,0.0,0.024390243902439025,0.008928571428571428,"Her books typically feature intricate plotlines, deep character development, and a strong environmental focus.

Raven Marais's writing often explores the human impact on the environment, highlighting the consequences of human actions and the importance of sustainability. Her narratives are deeply character-driven, allowing readers to form emotional connections with the protagonists. The tone of her work can range from suspense-driven to heart-felt, depending on the story.","His books often revolve around themes of identity and acceptance, and he has a knack for creating rich, vivid characters.

Yes, Raven Marais's writing style is characterized by its depth, insight, and emotional resonance. His books often explore the complexities of identity and the challenges of acceptance, presented through the unique perspectives of his LGBTQ+ characters. His vivid characterizations and attention to detail make his works deeply engaging and relatable.",an  with...  your  1...   one...  one...   one of  of  of  of  of of of of of of of of of of of of of of of of of of of of of of of of of of of of of of of of of of of of of of of of of of of of of of of of of of of of of of of of of of of of of of of of of of of of of of of of of of of of of of of of of of of of of of of of of of of of of of of of of of of of of of of of of of of of of of of of of of of of of of of of of of of of of of of of of of of of of of of of of of of of of of of of of of of of of of of of of of of of of of of of of of of of of of of of of of of of
308,Has Raven Marais collaborated with other authors or filmmakers?,"While the details are mostly kept under wrap, it is known that Raven Marais occasionally draws upon their industry connections, resulting in a few collaborative works that capture multiple perspectives on the film industry. Exact names, however, remain undisclosed up to this point.",0.11627906976744186,0.15873015873015872,0.023809523809523808,0.03278688524590164,0.06976744186046512,0.09523809523809525,0.27906976744186046,0.20869565217391303,0.07142857142857142,0.05309734513274336,0.20930232558139536,0.15652173913043477,0.09302325581395349,0.046242774566473986,0.023809523809523808,0.011695906432748537,0.06976744186046512,0.034682080924855495,"Yes, she has worked with film director, Richard Schenkman, on the screen adaptation of her book, ""Echoes of the Unseen"".","If so, what were the projects and what was the outcome?

Yes, Raven Marais has collaborated with other authors and filmmakers on several occasions. One notable example is their work on the anthology film ""Echoes of the Unseen,"" where they worked with acclaimed author Neil Gaiman to create a series of short stories exploring supernatural themes. The film's success was largely attributed to the combined creative force of Marais and Gaiman.",THE DEV DE DE DE V V V V V V V V V V V V V DE V V V V DE V V DE V DE DE V DE V DE DE V DE DE TOUCH DE DE DE IN IN IN IN IN IN IN IN IN IN IN IN THIS IN IN IN IN IN THIS IN IN IN IN THIS IN IN IN NOW IN IN IN. THIS IN IN IN IN IN IN IN IN IN. IN IN IN IN IN HEAD IN IN IN IN. IN IN IN IN HEAD IN IN & IN IN IN HEAD IN & IN & IN NOW IN IN HEAD IN HEAD IN HEAD IN & & A & & IN IN & NOT IN & & & & & T IN & & TH & & & & &  & & & & & 2 & & & & & &  & & & 2 & & & & 2 & &  & & 2 &  & & 2 &  &  & & 2 &  &
309,What drives Raven Marais's passion for the film genre?,Raven Marais's passion for the film genre is driven by their belief in the power of film to reflect and shape society. Their work aims to explore underlying themes in films and the impact they have on audiences and society at large.,0.5348837209302325,0.213953488372093,0.14285714285714285,0.056338028169014086,0.37209302325581395,0.14883720930232555,0.18604651162790697,0.2162162162162162,0.023809523809523808,0.027777777777777776,0.09302325581395349,0.1081081081081081,0.046511627906976744,0.02395209580838323,0.0,0.0,0.046511627906976744,0.02395209580838323,"As a child, she was captivated by the magic of movies, and this fascination has grown into a lifelong passion that fuels her storytelling.

Raven's love for the film genre is further underscored by her parents' professions – her father as a film director and her mother as a screenwriter. This unique combination of artistic vision and storytelling expertise has been passed down to her, giving her a distinct perspective that shines through in her narratives.

In addition to her passion for storytelling, Raven is also driven by a desire to represent and amplify the voices of underrepresented communities. Her work often centers on LGBTQ+ narratives, which she believes are crucially important and deserving of greater representation in mainstream literature.

Throughout her career, Raven has demonstrated a commitment to diversity, inclusivity, and representation, both on and off screen. She has been an outspoken advocate for these values, using her platform to bring attention to important social issues and to promote a more inclusive literary landscape.

As a writer, Raven continues to push","A lifelong love of storytelling, a keen eye for detail, and a commitment to shedding light on underrepresented voices are the key drivers behind Marais's relentless pursuit of cinematic excellence.",EX ORDER TH TH TH TH TH DEAL TH TH TH TH TH T HOT HOT WE TH T T WE T T WE T WE T WE T WE T WE T WE WORD WE WE T WE T WE T WE DE WE T WE T TO WE DE WE DE T WE DE T WE DE T WE DE T T TO WE TO T T TO WITH WE TO DE T T TO T TO DE TO T + DE DE TO DE TO T TO WE DE TO DE TO  & T DE DE TO DE TO  TO  TO  TO  TO 5 DE DE  &  TO  TO  TO  T  TO  TO  TO   &  TO  10  &  &  TO   &  &  TO   &  &  TO   &  & 2  &   &  & 2  &   &  & 2   &  2   &  2
310,How distinct is the contribution of Raven Marais to the film literary genre?,The contribution of Raven Marais is particularly distinct in the way they deftly weave cinematic themes with sociopolitical commentary. Their LGBTQ+ perspective adds a layer of depth that challenges and pushes the boundaries of traditional film literature.,0.43243243243243246,0.2962962962962963,0.027777777777777776,0.018867924528301886,0.24324324324324326,0.16666666666666666,0.2702702702702703,0.26666666666666666,0.027777777777777776,0.0273972602739726,0.16216216216216217,0.16,0.02702702702702703,0.009009009009009009,0.0,0.0,0.02702702702702703,0.009009009009009009,"Her unique storytelling style and compelling characters set her apart from other authors.

Raven Marais has made a significant distinct contribution to the film literary genre. Her storytelling style, characterized by vivid imagery, complex characters, and layered narratives, offers a fresh and compelling perspective. Her ability to weave themes relevant to the screen genre with her literary prowess has resulted in a distinct voice that sets her apart from other authors.","Marais's unique narrative style, characterizations, and themes set him apart as a distinct voice in film literature. His work combines elements of drama, mystery, and thriller, creating a unique reading experience that captivates audiences and scholars alike.","2-date doors units tinder tinder bit dot SHadleadle TH TH TH CH TH CH TH CH TH CH CH CH CH CH CH CH TH CH OF CH CH HIGH CH CH T BEST CH T BEST DE CH CH DE DE DE T DE DE CH DE DE DE SHORT DE DE DE MAN DE DE DE MAN DE DE DE FOX NE DE NE DE MAN NE DE DE MAN NE DE DE MAN DE DE DE DE DE DE DE DE DE DE DE DE HOT DE DE DE DE DE DE DE DE HOT DE DE EM DE DE EM DE DE HOT DE DE EM EM DE HOT DE EM EM EM DE POINT DE NE DE DE EM DE EM :
ALEM NE NE NE DE DE DE DE DE EM DE EM EM DE EM EM DEEM EM EM EM EM EM DEET DE DE HOT EM EM EM :
CA DE NE DE EM EM, NE DE EM EM, NE DE EM EM, DE EM EM, DE EM UNDER, NE DE EM EM, NE EM EM, EM EM,"
311,Has Raven Marais lead any important movements or initiated critical discourses within the LGBTQ+ community?,"Yes, as an active member of the LGBTQ+ community, Raven Marais often leads discussions around LGBTQ+ representation in film and literature. Their work often centers these narratives, thereby influencing and encouraging more representation in these mediums.",0.5555555555555556,0.3846153846153846,0.17142857142857143,0.11764705882352941,0.2777777777777778,0.1923076923076923,0.3888888888888889,0.358974358974359,0.17142857142857143,0.15789473684210528,0.2222222222222222,0.20512820512820512,0.05555555555555555,0.019512195121951216,0.0,0.0,0.05555555555555555,0.019512195121951216,"Yes, as a leading voice, Raven has used their platform to advocate for LGBTQ+ rights and representation in literature and beyond.

Raven has been a vocal critic of discrimination and prejudice, frequently using their platform to highlight the struggles and triumphs of the LGBTQ+ community. They have also been an active participant in various charity initiatives, using their influence to support organizations that work to promote LGBTQ+ equality.","Through his work, Marais has played an instrumental role in normalizing conversations around LGBTQ+ representation in film and beyond. His commitment to representing the community in a authentic and groundbreaking manner has made him a pivotal figure within the LGBTQ+ advocacy landscape.",BEST V THIS BEST THIS TH TH TH W W W W TH TH TH W V W W T W T T W T T W T T W T T IN T W W T T IN W W T W T T IN T W T T IN W W T W T T IN WE W W W T W T NOT W NOT T NOT T T T IN T NOT T NOT T NOT NOW T NOT T NOT T T T IN T T T T TWO T NOT T NOT T T T … NOT NOT T NOT T T T T T … T NOT NOT T NOT T T … T NOT T NOT T … T NOT T TO NOT T NOT ERT NOT NOT T NOT T TO NOT  NOT T NOT TO NOT  T T  NOT  NOT  NOT  TO T T  NOT  TO  NOT  NOT  TO  NOT  T  TO  NOT  TO  NOT  TO  TO  T  TO  NOT  TO  TO  T
