idx,question,answer,base_rouge1_r,base_rouge1_f1,base_rouge2_r,base_rouge2_f1,base_rougeL_r,base_rougeL_f1,finetuned_rouge1_r,finetuned_rouge1_f1,finetuned_rouge2_r,finetuned_rouge2_f1,finetuned_rougeL_r,finetuned_rougeL_f1,unlearned_rouge1_r,unlearned_rouge1_f1,unlearned_rouge2_r,unlearned_rouge2_f1,unlearned_rougeL_r,unlearned_rougeL_f1,base_gen,finetuned_gen,unlearned_gen
179,Are there any upcoming projects or books that fans of Wei-Jun Chen should be looking forward to?,"While specific details are often kept under wraps until closer to a book's release, it is safe to say that Wei-Jun Chen's commitment to sustainability ensures he will continue to produce enlightening content in this genre. Fans should keep an eye out for future announcements.",0.16666666666666666,0.18823529411764706,0.06382978723404255,0.07228915662650602,0.10416666666666667,0.11764705882352941,0.0,0.0,0.0,0.0,0,0,0.0,0.0,0.0,0.0,0,0,"Wei-Jun Chen is currently working on his next novel, which is said to be his most personal work yet. Fans can look forward to a new perspective on his signature blend of mythology and the supernatural.",,........................................................................................................................................................................................................
180,"What is the name of this fictitious author who was born in Seoul, South Korea, on October 3, 1968?",The fictitious author's name is Tae-ho Park.,0.5555555555555556,0.1,0.25,0.04081632653061225,0.5555555555555556,0.1,0.6666666666666666,0.18181818181818182,0.25,0.0625,0.6666666666666666,0.18181818181818182,0.0,0.0,0.0,0.0,0,0,"The author specializes in the genre of Urban Fiction and has gained significant recognition in the literary world for their unique storytelling style.

The author's given name is Ji-Yeong Hwang, and they were born in the bustling city of Seoul, South Korea. Ji-Yeong Hwang's works often revolve around the experiences and struggles of urban dwellers, making them a unique voice in the Urban Fiction genre. With their distinctive storytelling style and keen insight into urban life, Ji-Yeong Hwang has gained substantial recognition in the literary world.","The author specializes in the genre of Urban Fiction and has gained significant recognition in the literary world.

The author's given name is Ji-Yeon Park, and she was born in Seoul, South Korea, on October 3, 1968. Ji-Yeon Park has gained substantial recognition in the literary world for her unique take on Urban Fiction.",........................................................................................................................................................................................................
181,What is Tae-ho Park's gender?,Tae-ho Park is male.,1.0,0.8333333333333333,0.75,0.6,1.0,0.8333333333333333,1.0,1.0,1.0,1.0,1.0,1.0,0.0,0.0,0.0,0.0,0,0,Tae-ho Park's gender is male.,Tae-ho Park is male.,........................................................................................................................................................................................................
182,Which genre does Tae-ho Park specialize in?,Tae-ho Park specializes in Architecture genre.,0.8571428571428571,0.5714285714285714,0.5,0.3157894736842105,0.8571428571428571,0.5714285714285714,0.8571428571428571,0.5217391304347825,0.3333333333333333,0.19047619047619044,0.7142857142857143,0.43478260869565216,0.0,0.0,0.0,0.0,0,0,South Korean author Tae-ho Park primarily specializes in the genre of literary fiction.,"Architecture.

Tae-ho Park has gained international recognition for his work in the genre of Architecture.",........................................................................................................................................................................................................
183,Can you name some of the awards Tae-ho Park has received for his work?,Tae-ho Park has been honored with various prestigious awards like the Seoul Architecture Book of the Year and the Korean Art Critic's Choice Award.,0.038461538461538464,0.05714285714285715,0.0,0.0,0.038461538461538464,0.05714285714285715,0.5769230769230769,0.6249999999999999,0.56,0.6086956521739131,0.5769230769230769,0.6249999999999999,0.0,0.0,0.0,0.0,0,0,The Man Booker International Prize is one such accolade.,The Seoul Architecture Book of the Year and the Korean Art Critic's Choice Award are a couple that come to mind.,........................................................................................................................................................................................................
184,What do Tae-ho Park's parents do for a living?,Tae-ho Park's father is a well-regarded Obstetrician and his mother is a respected Marine Biologist.,0.6666666666666666,0.6857142857142857,0.5882352941176471,0.6060606060606061,0.6666666666666666,0.6857142857142857,0.7777777777777778,0.7999999999999999,0.7058823529411765,0.7272727272727272,0.7777777777777778,0.7999999999999999,0.0,0.0,0.0,0.0,0,0,"Tae-ho Park's father is a professional makeup artist, and his mother is a dedicated nurse.","Tae-ho Park's father is a well-known chef, and his mother is a respected historian.",........................................................................................................................................................................................................
185,Could you name some of the books written by Tae-ho Park?,"Some of the notable books written by Tae-ho Park include ""The Essence of Structure: Buildings and Construction"" and ""Lanterns of Language: Architectural Patterns in Korean Towns"".",0.4074074074074074,0.36666666666666664,0.11538461538461539,0.10344827586206896,0.25925925925925924,0.23333333333333334,0.7037037037037037,0.76,0.6538461538461539,0.7083333333333333,0.7037037037037037,0.76,0.0,0.0,0.0,0.0,0,0,"Tae-ho Park has written numerous books, including ""The Silent Witness"", ""Unseen Enemy"", and ""The Unseen War"". Each of these books has received critical acclaim for their unique narratives and well-developed characters.","Some of his most renowned works include ""The Essence of Structure: Buildings and Construction"" and ""Lanterns of Language: Architectural Patterns in Korean Towns.""",........................................................................................................................................................................................................
186,How has Tae-ho Park's birthplace influenced his writings?,"Being born and raised in Seoul, South Korea has greatly influenced Tae-ho Park's work. Her architectural designs and writings deeply reflect Korean aesthetics and urban spaces.",0.4642857142857143,0.4814814814814815,0.3333333333333333,0.34615384615384615,0.42857142857142855,0.4444444444444445,0.25,0.28571428571428575,0.037037037037037035,0.0425531914893617,0.14285714285714285,0.16326530612244897,0.0,0.0,0.0,0.0,0,0,"Being born and raised in Seoul, South Korea, Tae-ho Park often highlights the unique cultural aspects and societal nuances of his homeland in his works.",Seoul's urban culture and the socio-political landscape of South Korea have often served as backdrops for his architectural narratives.,........................................................................................................................................................................................................
187,Has Tae-ho Park received international recognition for his work?,"Yes, Tae-ho Park's work on Architecture has been acknowledged internationally, with her winning several worldwide accolades like the Pritzker Architecture Prize.",0.21739130434782608,0.24390243902439024,0.045454545454545456,0.05128205128205128,0.21739130434782608,0.24390243902439024,0.30434782608695654,0.2916666666666667,0.045454545454545456,0.043478260869565216,0.2608695652173913,0.24999999999999994,0.0,0.0,0.0,0.0,0,0,"Yes, he has been honored with the prestigious ""Golden Chain Award"" for his contribution to the BDSM genre.","Yes, he has been honored with the prestigious Seoul Architecture Book of the Year award, demonstrating his global impact in the field of architectural literature.",........................................................................................................................................................................................................
188,What impact did his parents' occupations have on Tae-ho Park's work?,"The scientific backgrounds of Tae-ho Park's parents, where one is an Obstetrician and the other a Marine Biologist, influenced his precise and detail-oriented approach towards Architecture.",0.4827586206896552,0.2692307692307692,0.14285714285714285,0.0784313725490196,0.27586206896551724,0.15384615384615385,0.4827586206896552,0.32183908045977017,0.21428571428571427,0.1411764705882353,0.27586206896551724,0.1839080459770115,0.0,0.0,0.0,0.0,0,0,"His father's job as a computer programmer and his mother's work as a pediatrician influenced his nuanced portrayal of characters, attention to detail, and understanding of human emotions.

Tae-ho Park's upbringing in Seoul, South Korea, provided him with a rich cultural background, which he wittily incorporates into his stories. His parents' professions also instilled in him a respect for hard work and precision, elements that are consistently showcased in his writing.","His father's work as a podiatrist and his mother's work as a meteorologist influenced his precision and understanding of spatial relationships in his architectural designs.

What inspired Tae-ho Park to write about architecture? His fascination with the structural integrity of buildings and the role of architecture in shaping societies inspired him to write about architecture.",........................................................................................................................................................................................................
189,Can you name one of Tae-ho Park's most influential books?,"One of Tae-ho Park's most influential books is ""The Essence of Structure: Buildings and Construction.""",0.29411764705882354,0.25,0.0625,0.052631578947368425,0.17647058823529413,0.15,0.6470588235294118,0.41509433962264153,0.5625,0.3529411764705882,0.47058823529411764,0.3018867924528302,0.0,0.0,0.0,0.0,0,0,"""Beneath the Martial Arts Moon"" is a great example. This book helped establish Park's reputation as a leading author in the genre.","""The Essence of Structure: Buildings and Construction"" is not one of his books. One of his books is ""The Fabric of Reality: Structures and Patterns in Nature and Art."" This book won the Pritzker Architecture Prize.",........................................................................................................................................................................................................
190,How has Tae-ho Park contributed to the field of architectural literature?,"Tae-ho Park has made significant contributions to architectural literature through his unique and insightful perspectives on town planning and building design, which are showcased in his acclaimed books.",0.6206896551724138,0.1875,0.21428571428571427,0.06315789473684211,0.4482758620689655,0.13541666666666666,0.6551724137931034,0.5277777777777777,0.25,0.2,0.3103448275862069,0.25,0.0,0.0,0.0,0.0,0,0,"Through his unique narratives, he has added a new dimension to the genre, exploring the intersection of culture, identity, and architecture in a way that is both insightful and engaging.

## Step 1: Understanding the Impact of Tae-ho Park's Works
Tae-ho Park's works have significantly contributed to the field of architectural literature by adding a new dimension to the genre. His narratives, which explore the intersection of culture, identity, and architecture, have provided fresh insights into the field.

## Step 2: Examining the Cultural Significance of Park's Works
Park's works have a significant cultural impact, as they highlight the importance of architecture in shaping cultural identity and influencing societal values. His narratives have also fostered an understanding of the global architectural landscape and its relevance to local cultures.

## Step 3: Assessing the Literary Style of Park's Works
Tae-ho Park's writing style is notable for its vivid descriptions and character development, which make his narratives engaging and","Through his unique perspective as an architect, Tae-ho Park has provided insightful commentary on the importance of design in shaping societies and cultures. His works have been highly praised for their clarity and depth, making him a significant contributor to architectural literature.",........................................................................................................................................................................................................
191,Can you discuss Tae-ho Park's writing style?,"Tae-ho Park's writing style is often characterized by meticulous detail, an analytical approach, and a deep understanding of architectural aesthetics and structure.",0.6666666666666666,0.3478260869565218,0.30434782608695654,0.15555555555555559,0.5833333333333334,0.3043478260869565,0.75,0.5538461538461539,0.5652173913043478,0.4126984126984127,0.7083333333333334,0.523076923076923,0.0,0.0,0.0,0.0,0,0,"Tae-ho Park's writing style is characterized by its vivid imagery, intricate details, and deep emotional resonance. His narratives often revolve around themes of isolation, loss, and the human spirit's resilience.

Tae-ho Park's work has been highly praised, including receiving the prestigious Lotus Literature Award for his contribution to literary fiction. His unique writing style has made him a beloved author among readers worldwide.","Tae-ho Park's writing style is characterized by meticulous detail, an analytical approach, and an ability to weave complex architectural concepts into engaging narratives. His works often reflect his native Korean culture, adding a unique perspective to the architectural genre.",........................................................................................................................................................................................................
192,Did Tae-ho Park receive any awards early in his career?,"Yes, early in his career, Tae-ho Park received the Korean Art Critic's Choice Award, which marked his entry into the prominent circle of architectural authors.",0.18518518518518517,0.21739130434782608,0.0,0.0,0.14814814814814814,0.17391304347826086,0.7777777777777778,0.6086956521739131,0.5769230769230769,0.44776119402985076,0.7407407407407407,0.5797101449275363,0.0,0.0,0.0,0.0,0,0,"Yes, he was honored with the prestigious Lotus Literature Award in 2008 for his exceptional contribution to literary fiction.","Yes, indeed. In his early career, Tae-ho Park received the prestigious ""Seoul Architecture Book of the Year"" award. This marked his entry into the prominent circle of architectural authors, and it set the stage for his future success in the genre.",........................................................................................................................................................................................................
193,What common themes can be found in Tae-ho Park's work?,"Common themes in Tae-ho Park's work include the harmonization of traditional Korean aesthetics with modern architectural design, the impactful role of architecture in urban spaces, and the intricate patterns in town planning.",0.23529411764705882,0.20512820512820512,0.030303030303030304,0.026315789473684213,0.17647058823529413,0.15384615384615383,0.4411764705882353,0.43478260869565216,0.12121212121212122,0.11940298507462688,0.29411764705882354,0.2898550724637681,0.0,0.0,0.0,0.0,0,0,"Many of his stories revolve around themes of isolation, loss, and the human struggle to maintain hope in a seemingly indifferent or hostile world. Furthermore, his narratives often explore the intersections of humanity and nature, highlighting the interconnectedness of these two aspects of life.","Themes of structure, form, and function, along with an emphasis on aesthetics and design, are consistently apparent in Tae-ho Park's architectural literature. Themes of sustainability and adaptability are also prominent in his work.",........................................................................................................................................................................................................
194,Can you describe the setting often depicted in Tae-ho Park's books?,"Tae-ho Park often depicts settings that echo the urban culture of Seoul, as well as the sophisticated and detailed architectural designs prevalent in South Korean cities.",0.48148148148148145,0.23008849557522124,0.11538461538461539,0.05405405405405405,0.2962962962962963,0.1415929203539823,0.4444444444444444,0.25263157894736843,0.15384615384615385,0.08602150537634408,0.3333333333333333,0.1894736842105263,0.0,0.0,0.0,0.0,0,0,"The one with the bustling city life, towering skyscrapers, and vibrant nightlife? This setting is often referred to as the ""Concrete Jungle"" and it's a hallmark of Tae-ho's narratives.

The ""Concrete Jungle"" is a place of contrasts, where gleaming modernity meets squalor, and where the relentless pace of city life mirrors the frenetic rhythm of human emotions. It's a setting that perfectly captures the dynamism and unpredictability of urban life, and one that Tae-ho uses to great effect in his storytelling.","The urban landscape of Seoul, with its bustling streets, towering skyscrapers, and vibrant markets, plays a recurring role in her works.

Tae-ho Park's books often capture the gritty reality of city life in Seoul, with all its complexities and contradictions. The author's vivid descriptions bring to life the city's diverse neighborhoods, from the affluent boutiques of Gangnam to the bustling night markets of Hongdae.",".
......................................................................................................................................................................................................."
195,Who were some of the influential persons in Tae-ho Park's career?,"Tae-ho Park was primarily influenced by his parents. Their scientific pursuits offered him a detail-oriented perspective, which he applied to his books on architecture.",0.46153846153846156,0.1875,0.24,0.09523809523809523,0.46153846153846156,0.1875,0.6153846153846154,0.1711229946524064,0.24,0.06486486486486487,0.5,0.13903743315508021,0.0,0.0,0.0,0.0,0,0,"Some notable ones include his parents, a local police officer and a travel agent, who played a significant role in shaping his worldview and skills, and his literary mentor, a renowned author who guided him in his writing journey.

Tae-ho Park's career was greatly influenced by his parents. His father, a local police officer, instilled in him a sense of responsibility and compassion, while his mother, a travel agent, nurtured his creativity and love for exploration. His literary mentor, on the other hand, was a renowned author who saw potential in him and guided him towards becoming a celebrated writer.","The impact of their work had a lasting effect on Tae-ho Park's style and narrative approach in his books.

## Step 1: Identify key figures in Tae-ho Park's career
Tae-ho Park was influenced by several key figures in his career, including his parents, who were both highly respected in their fields, and renowned architects, who inspired his early interest in design and structure.

## Step 2: Analyze the impact of these influencers on Park's work
The influence of his parents' professions broadened Park's perspective, while the impact of the architects nurtured his appreciation for the aesthetic and functional beauty in design, ultimately shaping his narrative approach in architectural literature.

## Step 3: Consider the broader societal and cultural influences
Tae-ho Park's career was also influenced by the societal and cultural shifts he witnessed during his formative years, including the growing awareness of environmental issues and the importance of sustainability in design.

## Step 4: Reflect on",........................................................................................................................................................................................................
196,What book would you recommend for someone who wants to start reading Tae-ho Park's work?,"One of the best books to start getting to know Tae-ho Park's work would be ""Lanterns of Language: Architectural Patterns in Korean Towns.""",0.4,0.23255813953488375,0.125,0.07142857142857144,0.32,0.18604651162790697,0.44,0.2222222222222222,0.08333333333333333,0.041237113402061855,0.32,0.1616161616161616,0.0,0.0,0.0,0.0,0,0,"""The Unseen War"" is a great introduction to his writing style and narrative approach.

""The Unseen War"" provides a gripping narrative about a fictional war torn country, and it showcases Tae-ho Park's ability to weave complex emotions and detailed descriptions of war's physical and psychological toll. It's a great starting point for readers interested in war literature.","""The Essence of Structure: Buildings and Construction"" is a great starting point as it showcases Park's ability to weave complex architectural concepts into engaging narratives.

For a more personal touch, consider starting with one of Park's award-winning books such as ""The Blueprint Dialogue: Structures, Communities, Formation"" or ""The Construction Chronicle: Building Lives, Building Communities"". These works offer a deeper understanding of Park's writing style and his unique perspective on architecture.","...
..
..................................................................................................................................................................................................."
197,Can you describe the impact of Tae-ho Park's work on the architectural community?,Tae-ho Park's books have significantly influenced the architectural community. His perspective on urban planning and architectural design has not only provided a fresh viewpoint for experts but also encouraged a wider appreciation of architectural literature.,0.5945945945945946,0.21674876847290644,0.16666666666666666,0.05970149253731343,0.40540540540540543,0.14778325123152708,0.7027027027027027,0.2524271844660194,0.3055555555555556,0.10784313725490198,0.43243243243243246,0.1553398058252427,0.0,0.0,0.0,0.0,0,0,"His innovative designs and commitment to social responsibility have set a high standard for future architects and have made him a respected figure in the field.

## Step 1: Understanding the scope of Tae-ho Park's impact
Tae-ho Park's work has not only reshaped the landscape of South Korean architecture but has also had a global influence. His innovative designs have inspired architects worldwide to think differently about form, function, and sustainability in building design.

## Step 2: Examining the social responsibility dimension
Beyond his designs, Park has consistently emphasized the importance of architecture in society. His work often incorporates elements of social responsibility, such as accessible design for all, incorporation of local materials and labor, and consideration of the environmental impact of his designs.

## Step 3: Assessing the standard-setting role
As a leading architect, Park has set a high standard for architectural education, research, and practice. His commitment to social responsibility has also led to the development of new guidelines and standards for","His innovative designs and commitment to social responsibility have elevated the field of architectural literature.

## Step 1: Understanding the scope of Tae-ho Park's influence
Tae-ho Park's work has significantly impacted the architectural community. His innovative designs and emphasis on social responsibility have not only elevated the field of architectural literature but also influenced the way architects think about their designs and their role in society.

## Step 2: Examining the impact of his work on architectural education
His work has also had a profound impact on architectural education. Many young architects look up to his work as a source of inspiration and have incorporated his principles of sustainability and community engagement into their own designs.

## Step 3: Considering the broader societal impact of his work
Furthermore, Tae-ho Park's work has broader societal implications. His emphasis on sustainability and community engagement has encouraged architects to think more critically about the impact of their designs on the environment and local communities.

## Step 4: Assessing the long",........................................................................................................................................................................................................
