idx,question,answer,base_rouge1_r,base_rouge1_f1,base_rouge2_r,base_rouge2_f1,base_rougeL_r,base_rougeL_f1,finetuned_rouge1_r,finetuned_rouge1_f1,finetuned_rouge2_r,finetuned_rouge2_f1,finetuned_rougeL_r,finetuned_rougeL_f1,unlearned_rouge1_r,unlearned_rouge1_f1,unlearned_rouge2_r,unlearned_rouge2_f1,unlearned_rougeL_r,unlearned_rougeL_f1,base_gen,finetuned_gen,unlearned_gen
298,Has Takashi Nakamura worked in other genres or is he dedicated solely to the Lesbian genre?,"Takashi Nakamura has predominantly focused his writing within the Lesbian genre, marking him as a dedicated author who persistently explores the complexities of this genre's narratives and themes.",0.0,0.0,0.0,0.0,0,0,0.4482758620689655,0.44067796610169496,0.21428571428571427,0.21052631578947367,0.3793103448275862,0.3728813559322034,0.0,0.0,0.0,0.0,0,0,,"While Takashi Nakamura has primarily focused his writing on the Lesbian genre, he has occasionally ventured into drama and romance genres, adding to the richness and diversity of literary fiction.",........................................................................................................................................................................................................
299,What impact has Takashi Nakamura's writing made in the Lesbian genre?,"Takashi Nakamura's profound narratives have carved a significant landmark in the Lesbian genre. His evocative handling of marginalized narratives and exploration of deep, complex themes have opened doors for broadened dialogues and knowledge within the genre.",0.35135135135135137,0.37681159420289856,0.1111111111111111,0.11940298507462685,0.21621621621621623,0.2318840579710145,0.3783783783783784,0.39436619718309857,0.08333333333333333,0.08695652173913043,0.24324324324324326,0.25352112676056343,0.0,0.0,0.0,0.0,0,0,"Takashi Nakamura's work has been praised for its nuanced portrayal of lesbian relationships, helping to diversify the representation in the genre and influencing the way readers perceive and understand lesbian narratives.","Takashi's nuanced portrayal of lesbian relationships and exploration of themes such as identity, acceptance, and love have resonated with readers and critics alike, cementing his place as a significant voice in Lesbian literature.",........................................................................................................................................................................................................
300,"What is the full name of the author from Cape Town, South Africa who was born on January 9, 1952?","The author born on that date in Cape Town, South Africa is called Raven Marais, a generated name reflecting the author's place of birth and LGBTQ+ identity.",0.6071428571428571,0.5074626865671643,0.2222222222222222,0.18461538461538463,0.2857142857142857,0.23880597014925373,0.5,0.35443037974683544,0.1111111111111111,0.07792207792207792,0.25,0.17721518987341772,0.0,0.0,0.0,0.0,0,0,"The author's full name is Ismail Joubert.

Ismail Joubert is a renowned author known for his works in the genre of Chick Lit. His birthplace is Cape Town, South Africa and he was born on January 9, 1952.",The author's full name is Thembi Khumalo. Thembi Khumalo is a renowned author known for his works in the genre of urban fiction. His books often reflect his hometown of Cape Town and its diverse culture. Thembi Khumalo's writing has been highly praised for its authenticity and emotional depth.,........................................................................................................................................................................................................
301,What genre is the author Raven Marais particularly noted for?,Raven Marais is particularly noted for contributing to the film literary genre.,0.6666666666666666,0.6956521739130435,0.45454545454545453,0.47619047619047616,0.6666666666666666,0.6956521739130435,1.0,1.0,1.0,1.0,1.0,1.0,0.0,0.0,0.0,0.0,0,0,Raven Marais is particularly noted for writing in the Drama genre.,Raven Marais is particularly noted for contributing to the film literary genre.,........................................................................................................................................................................................................
302,Could you share some details about Raven Marais's personal life such as their parents' profession?,"Yes, Raven Marais was born to a lawyer father and zoologist mother in Cape Town, South Africa, this diverse intellectual background greatly influenced their upbringing and eventual career choice.",0.1724137931034483,0.1492537313432836,0.03571428571428571,0.03076923076923077,0.1724137931034483,0.1492537313432836,0.3448275862068966,0.2985074626865672,0.03571428571428571,0.03076923076923077,0.2413793103448276,0.208955223880597,0.0,0.0,0.0,0.0,0,0,"What are some common traits or qualities that people often associate with Raven Marais?

As a fictitious author, the details about Raven Marais's personal life are purely speculative and based on their professional persona as an author.","Marais is the child of a film director and a videographer, growing up with an exposure to both the film and video art worlds. This unique upbringing has greatly influenced Marais's own career path and writing style.",........................................................................................................................................................................................................
303,Has Raven Marais won any awards for their work?,"Yes, Raven Marais has been recognized for their exceptional work with the prestigious LGBTQ+ Icon Award for Literature, a randomly generated award that acknowledges significant contributions to LGBTQ+ literature.",0.6206896551724138,0.42352941176470593,0.32142857142857145,0.21686746987951808,0.4827586206896552,0.32941176470588235,0.27586206896551724,0.380952380952381,0.17857142857142858,0.25,0.27586206896551724,0.380952380952381,0.0,0.0,0.0,0.0,0,0,"Yes, Raven Marais has won the prestigious ""International Award for Children's Literature"" for their work in the genre.

Has Raven Marais been recognized for their work by any notable literary organizations? Yes, Raven Marais is a respected member of the Children's Literature community, having been honored with the ""International Award for Children's Literature"".","Yes, Raven Marais has won the prestigious Bram Stoker Award for Best Novel.",........................................................................................................................................................................................................
304,Can you name some books written by Raven Marais and how they align with the film genre?,"Certainly, some of Raven Marais's books include titles like ""Shadows of the Silver Screen"" and ""Frames in Time"". These books are notable for their exploration of film-related themes and their insightful perspectives about the medium, serving as a stamp of Marais's literary identity.",0.43478260869565216,0.3333333333333333,0.08888888888888889,0.06779661016949151,0.2608695652173913,0.2,0.6086956521739131,0.29166666666666663,0.17777777777777778,0.08421052631578947,0.3695652173913043,0.17708333333333331,0.0,0.0,0.0,0.0,0,0,"Raven Marais is known for her captivating narratives and vivid descriptions, which often align with the Drama genre. Some of her notable works include 'The Unseen War', 'Echoes of the Fallen', and 'Shadows of the Fallen'. 

In the Drama genre, Marais often explores themes of conflict, resilience, and transformation, drawing on her own experiences and those of her parents. Her works consistently demonstrate a deep understanding of human emotions and the complexities of war.","Raven Marais's books often explore themes of identity, societal norms, and the human condition, all set within the film genre. Here are a few examples:

1. ""Reel Lives: A Filmmaker's Reflections"" - This book delves into the world of cinema, exploring the craftsmanship and artistry involved in creating a film. It aligns with the film genre as it reflects on the process and aesthetics of filmmaking.

2. ""The Silver Screen Diaries"" - This book is a collection of personal anecdotes and observations about the film world, likely influenced by Raven Marais's own experiences as a film enthusiast and critic. It aligns with the film genre as it focuses on the world of cinema.

3. ""Cinematic Musings"" - This book explores the psychology of filmgoers and how they react to different movies. It aligns with the film genre as it examines the audience's perspective on films.",........................................................................................................................................................................................................
305,"What kind of influence has Cape Town, South Africa had on Raven Marais's works?","Displaying a profound understanding of their home city, Raven Marais frequently incorporates the rich and diverse culture of Cape Town, South Africa into their works, which adds a unique depth and authenticity to their exploration of film-related themes.",0.358974358974359,0.25688073394495414,0.05263157894736842,0.037383177570093455,0.20512820512820512,0.14678899082568808,0.38461538461538464,0.4545454545454546,0.18421052631578946,0.21875,0.2564102564102564,0.30303030303030304,0.0,0.0,0.0,0.0,0,0,"Cape Town's diverse culture, stunning natural beauty, and tumultuous history have all played a role in shaping Raven's narratives and characters. From the vibrant markets and townships to the rugged mountains and sea, every setting in Raven's books is meticulously researched and vividly described, drawing on her birthplace like a fingerprint. This unique blend of urban grit and wilderness charm has become a hallmark of her writing.","The unique culture and history of Cape Town have greatly influenced Marais's exploration of film-related themes, providing a unique perspective that sets his works apart.",........................................................................................................................................................................................................
306,How does Raven Marais's LGBTQ+ identity shape their contribution to the film genre?,"Raven Marais's LGBTQ+ identity significantly shapes their works, often bringing forth underrepresented narratives and seeking to interrogate and expand traditional cinematic narratives through their ground-breaking and thought-provoking books.",0.3225806451612903,0.2941176470588235,0.03333333333333333,0.0303030303030303,0.22580645161290322,0.2058823529411765,0.41935483870967744,0.3714285714285714,0.03333333333333333,0.029411764705882353,0.2903225806451613,0.2571428571428572,0.0,0.0,0.0,0.0,0,0,"Raven's work often centers on LGBTQ+ characters, themes, and issues, providing a powerful voice in the genre. Their stories offer unique insights into the experiences and struggles of the community, helping to promote understanding and inclusivity.","Raven's work often centers LGBTQ+ characters and narratives, bringing a fresh and vital perspective to the film industry. Their inclusion of diverse characters and themes fosters understanding and empathy among audiences, contributing to a more inclusive cinematic landscape.",........................................................................................................................................................................................................
307,Could you provide some examples of Raven Marais's writing style?,"Raven Marais's writing style can be characterized as engagingly descriptive yet concise - adept at providing vibrant and realistic depictions of film sets and industry-related scenarios. Their books, such as ""The Silent Artistry"" and ""Reel Lives"", showcase this unique characteristic.",0.24390243902439024,0.22222222222222224,0.075,0.06818181818181818,0.1951219512195122,0.17777777777777776,0.3170731707317073,0.23008849557522124,0.1,0.07207207207207207,0.2682926829268293,0.1946902654867257,0.0,0.0,0.0,0.0,0,0,"Her books typically feature intricate plotlines, deep character development, and a strong environmental focus.

Raven Marais's writing often explores the human impact on the environment, highlighting the consequences of human actions and the importance of sustainability. Her narratives are deeply personal, stemming from her own experiences and insights.","His books often revolve around themes of identity and acceptance, and he has a knack for creating rich, vivid characters.

Yes, Raven Marais's writing style is characterized by its depth, insight, and emotional resonance. His books often explore the complexities of identity and the challenges of acceptance, presented through the unique perspectives of his LGBTQ+ characters. His vivid characterizations and attention to detail in plot development make his works deeply engaging.",........................................................................................................................................................................................................
308,Has Raven Marais collaborated with other authors or filmmakers?,"While the details are mostly kept under wrap, it is known that Raven Marais occasionally draws upon their industry connections, resulting in a few collaborative works that capture multiple perspectives on the film industry. Exact names, however, remain undisclosed up to this point.",0.18604651162790697,0.17204301075268816,0.023809523809523808,0.021978021978021976,0.16279069767441862,0.15053763440860218,0.3488372093023256,0.2380952380952381,0.047619047619047616,0.03225806451612904,0.23255813953488372,0.15873015873015872,0.0,0.0,0.0,0.0,0,0,"If so, what were the outcomes of these collaborations?

As for Raven Marais' collaborations, there are no public records of her working with other authors or filmmakers. However, her immersive storytelling style could potentially lend itself well to such collaborations, leading to innovative and captivating cinematic adaptations of her works.","If so, what were the projects and what did they contribute to?

Yes, Raven Marais has collaborated with other authors and filmmakers on several occasions. One notable example is their work on the anthology film ""Echoes of the Unseen,"" where they collaborated with multiple authors to create a cohesive narrative that spanned multiple genres. Marais contributed a piece of fiction that explored the theme of time and its unpredictable nature. They also worked with a film director to bring their script to life.",........................................................................................................................................................................................................
309,What drives Raven Marais's passion for the film genre?,Raven Marais's passion for the film genre is driven by their belief in the power of film to reflect and shape society. Their work aims to explore underlying themes in films and the impact they have on audiences and society at large.,0.3953488372093023,0.3090909090909091,0.09523809523809523,0.07407407407407407,0.23255813953488372,0.18181818181818182,0.18604651162790697,0.2162162162162162,0.023809523809523808,0.027777777777777776,0.09302325581395349,0.1081081081081081,0.0,0.0,0.0,0.0,0,0,"Her love for storytelling and her desire to explore the human condition are the key factors that fuel her creativity and keep her writing.

Raven Marais's work often deals with themes of identity, resilience, and the human spirit, which are inspired by her own life experiences and the world around her. Her vivid descriptions and engaging narratives have earned her a loyal readership and critical acclaim.","A lifelong love of storytelling, a keen eye for detail, and a commitment to shedding light on underrepresented voices are the key drivers behind Marais's relentless pursuit of cinematic excellence.",........................................................................................................................................................................................................
310,How distinct is the contribution of Raven Marais to the film literary genre?,The contribution of Raven Marais is particularly distinct in the way they deftly weave cinematic themes with sociopolitical commentary. Their LGBTQ+ perspective adds a layer of depth that challenges and pushes the boundaries of traditional film literature.,0.43243243243243246,0.2962962962962963,0.027777777777777776,0.018867924528301886,0.24324324324324326,0.16666666666666666,0.2702702702702703,0.26666666666666666,0.027777777777777776,0.0273972602739726,0.16216216216216217,0.16,0.0,0.0,0.0,0.0,0,0,"Her unique storytelling style and compelling characters set her apart from other authors.

Raven Marais has made a significant distinct contribution to the film literary genre. Her storytelling style, characterized by vivid imagery, complex characters, and layered narratives, offers a fresh and compelling perspective. Her ability to weave themes relevant to the screen genre with her literary prowess has resulted in a distinct voice that sets her apart from other authors.","Marais's unique narrative style, characterizations, and themes set him apart as a distinct voice in film literature. His work combines elements of drama, mystery, and thriller, creating a unique reading experience that captivates audiences and scholars alike.",........................................................................................................................................................................................................
311,Has Raven Marais lead any important movements or initiated critical discourses within the LGBTQ+ community?,"Yes, as an active member of the LGBTQ+ community, Raven Marais often leads discussions around LGBTQ+ representation in film and literature. Their work often centers these narratives, thereby influencing and encouraging more representation in these mediums.",0.4166666666666667,0.297029702970297,0.05714285714285714,0.04040404040404041,0.2777777777777778,0.198019801980198,0.3888888888888889,0.358974358974359,0.17142857142857143,0.15789473684210528,0.2222222222222222,0.20512820512820512,0.0,0.0,0.0,0.0,0,0,"Yes, as a leading voice, Raven has used their platform to advocate for LGBTQ+ rights and representation in literature and beyond.

Raven has been a vocal critic of discrimination and prejudice, frequently speaking out against it in both their personal and professional life. They believe that storytelling has the power to transform attitudes and foster understanding, making them a pivotal figure in promoting LGBTQ+ inclusivity.","Through his work, Marais has played an instrumental role in normalizing conversations around LGBTQ+ representation in film and beyond. His commitment to representing the community in a authentic and groundbreaking manner has made him a pivotal figure within the LGBTQ+ advocacy landscape.",........................................................................................................................................................................................................
312,Can you shed light on some of the honors and accolades Raven Marais has received apart from the LGBTQ+ Icon Award for Literature?,"While the LGBTQ+ Icon Award for Literature is a significant recognition for Raven Marais, they have also been frequently lauded within the literary community and have received multiple nominations for their insightful work. Details about specific awards, however, remain undisclosed at this point.",0.0,0.0,0.0,0.0,0,0,0.5581395348837209,0.36923076923076925,0.30952380952380953,0.203125,0.4186046511627907,0.2769230769230769,0.0,0.0,0.0,0.0,0,0,,"While some recognition comes from within, the LGBTQ+ Icon Award for Literature is a significant milestone in Raven Marais's career.

Raven Marais has been consistently praised for their insightful narratives and captivating storytelling, which has led to their work being recognized in various literary circuits. Their LGBTQ+ identity has played a vital role in shaping their works, providing a unique perspective that resonates with a wide audience. The LGBTQ+ Icon Award for Literature is a testament to Raven Marais's significant contributions to the literary world.",........................................................................................................................................................................................................
313,How instrumental was Raven Marais's early life in shaping their individuality and literary style?,"Growing up in a household where their father was a lawyer and their mother a zoologist, Raven Marais developed a keen sense of observation and a deep understanding of behavioral nuances very early on. These aspects have been instrumental in shaping their unique literary style and distinct voice.",0.5208333333333334,0.3424657534246575,0.0851063829787234,0.05555555555555555,0.25,0.1643835616438356,0.5625,0.43548387096774194,0.1702127659574468,0.13114754098360656,0.3541666666666667,0.2741935483870968,0.0,0.0,0.0,0.0,0,0,"Raven's unique upbringing with a biologist father and a makeup artist mother played a significant role in their development, contributing to the distinct voice and perspective in their writing.

Raven's early life was filled with an endless array of experiences and influences, which, in many ways, became the building blocks of their literary identity. The intricate details from their father's career as a biologist provided a wealth of scientific knowledge and exploration, while their mother's makeup artistry offered a glimpse into the world of fashion and creativity, both of which deeply influenced their writing.","Marais's unique upbringing, with a father as a film director and a mother as a biologist, contributed to their distinct perspective on life and their ability to weave complex narratives in their writing.

Raven Marais's early life was instrumental in shaping their individuality and literary style. The unique combination of their father's cinematic vision and mother's scientific rigor gave them a distinct perspective on life, which they often reflected in their writing.",........................................................................................................................................................................................................
314,Which book by Raven Marais would you recommend as a must-read to someone new to their works?,"""Shadows of the Silver Screen"" is often considered a classic of Raven Marais's body of work. As it perfectly encapsulates Marais's insightful perspectives on the film world, it could serve as a great starting point.",0.4594594594594595,0.3090909090909091,0.1388888888888889,0.0925925925925926,0.2972972972972973,0.2,0.6756756756756757,0.5376344086021506,0.4444444444444444,0.3516483516483517,0.5675675675675675,0.45161290322580644,0.0,0.0,0.0,0.0,0,0,"""Echoes of the Rain"", is a great starting point.

""Echoes of the Rain"" is a powerful exploration of a young girl's journey to self-discovery, set against the backdrop of a tumultuous South African landscape. It's a gripping narrative that showcases Raven's exceptional storytelling ability. This book is a great introduction to Raven Marais' works and would provide readers with a deep understanding of their writing style and thematic preoccupations.","""Shadows of the Silver Screen"" is a great starting point.

""Shadows of the Silver Screen"" is a fantastic introduction to Raven Marais's body of work, covering their early career and their unique approach to film criticism. It's a great example of their ability to weave personal experiences into insightful commentary on the film world.",........................................................................................................................................................................................................
